순번,Q,A
7375,사격통제장치,"목표의 현재위치를 레이더 등으로 포착하여 컴퓨터에 의해 목표의 이동방향이나 속도 등을 계산하고 화포성능에 대응하는 미래위치를 예측하여 산출된 방향으로 화포를 지향, 조준하는 장치를 가리킨다. 사람의 눈으로 직접 보면서 목표를 조준하던 것을 레이더와 컴퓨터 등의 도입으로 자동화할 수 있게 되어 항공기와 같은 고속의 이동목표에도 유효한 사격이 가능하게 되었다. 기관총, 대공포, 전차포와 같은 직사화기에서는 탄도계산기와 화포구동장치 가 통합되어 사격통제장치를 구성하며, 야포와 같은 곡사화기에서는 사표제원, 지도상의 목표 위치, 화포위치, 기상제원 등을 계산기에 입력하여 사격제원을 산출하는 사격통제장치를 사용한다. 또한 미사일과 같은 공중병기에 있어서도 유도방식에 따라 여러 종류의 사격통제장치가 시스템으로 기능을 다하고 있다."
7494,사이버공간,"컴퓨터통신망 안에 존재하는 가상공간을 가리킨다. 이에는 인터넷, 국가통신망, 지휘통제망, 전투력 운용망, 금융전산망 등 인공지능체계가 운용되는 모든 컴퓨터통신 기반의 공간 및 가상현실 등이 포함된다. 실제적 공간에 비해 물리적, 현실적 제약이 적으나 아직 완전히 별개의 공간으로서 구체화된 것은 아니다. 이 안에서는 상대의 사이버공간체계를 교란하고 방해하기 위한 지휘통제전, 해커전을 비롯한 사이버전이 수행된다."
7520,사주방어,"방어의 주력은 적의 공격방향에 지향시킨 상태에서 어느 방향으로부터의 적의 위협에도 대처할 수 있도록 해 둔 방어편성을 가리킨다. 화력지원 부대를 본부와 함께 중심에 둔 상태에서 이를 둘러싸듯이 동심원상으로 진지가 구축되는 것이 일반적인 형태로, 베트남전쟁 시기에 한국군이 사용했던 중대전술기지의 형태가 대표적인 사주방어 형태에 속한다."
7534,사탄산포,"1문의 포, 혹은 여러 문의 포가 동일한 사격 제원(동일할 롯드 번호의 포탄, 동일 사각 및 편각)으로 발사한 포탄, 혹은 동일한 조건 하에서 투하된 폭탄이 동일 지점에 떨어지지 않고 분산된 파열 형태를 나타내는 현상, 혹은 그러한 탄착의 모양. 탄착점은 횡과 종으로 산포되는데, 이는 포탄 제조상의 불가피한 오차 범위와 매 사탄간의 사소한 변화로 인하여 생기는 것으로, 조작의 잘못으로 인하여 생기는 탄착점 변화와는 다르므로 혼동해서는 안 된다."
7551,삭도수송,"격오지와 같은 곳에서 삭도를 이용하여 보급물자 및 인원을 수송하는 것을 가리킨다. 케이블카 수송이라고도 한다. 여러 개의 강철빔에 의하여 지지되고 있는 와이어로프에 물자나 삭도차량을 매달아 공중수송하는 방식으로 운용되며, 이는 지형이 매우 험난하여 지상으로 횡단하기 곤란하고 도로가 건설되어 있지 않는 격오지의 산간 지대나 선박의 접안, 또는 항만 및 해변작업이 불가능한 수역과 그 안의 도서지역 등에서 보급이나 병력이동을 행해야 할 경우 주로 사용된다. 민간용의 산악관광 및 이동수단으로서도 사용된다."
7575,산악작전,"산악지역에서 이루어지는 작전을 가리키며, 일반적으로 표고 500미터 이상의 지형에서 실시되는 작전을 말한다. 산악지역은 험준한 경사, 암석, 절벽, 협곡, 우거진 삼림, 제한된 도로망과 극심한 기상변화 등의 특징을 갖는데, 이로 인하여 부대의 기동이 제한되며 사격효과가 감소되고 통신 및 전투근무지원이 곤란해진다. 따라서 산악지역에서는 대부대의 운용이 곤란하고 병참선 확보 및 차단작전의 중요성이 증대된다. 산악지역의 경우 일반적으로 공격자보다는 지형지물을 이용할 수 있는 방어자가 유리하나, 방어자의 반응속도를 둔화시키고 공격자의 기동을 은닉하여 기습을 쉽게 한다는 점에서 공격자에게도 유리한 점이 있다. 산악지역에 대한 공격작전을 수행할 때, 주간에 정면공격을 실시하게 되면 험준한 지형으로 인하여 전투원의 피로가 늘며 많은 피해를 입기 쉬우므로 적 방어진지 사이의 간격으로 침투하거나 노출된 측방을 통하여 포위 및 우회기동을 실시하는 것이 보다 유리하며, 이에는 공정작전 등이 매우 효과적이다. 또한 대부대로 산악지역에 대한 공격작전을 행할 경우 지형적 특성(기동로의 제한 등)으로 인하여 작전 도중에 부대의 기동방향을 수정하기 어려우므로 최초 기동계획을 결정함에 있어 지형 및 상황 등을 면밀히 검토하여야 한다. 산악지역에 대한 방어작전을 수행하는 측에서는 공격자의 집중이나 침투에 취약하고 반응속도가 둔해져서 부대가 고립되기 쉬우나, 지형이 갖는 천연적 방호력을 최대한 이용할 수 있으며 이로 인한 병력 절약이 가능하고 화력지원, 지휘통제, 전투근무지원면에서 공격측보다 우위에 서게 되므로 이러한 장점들을 최대로 활용하고 적 활동에 대한 반응속도를 높이기 위한 감시체계의 강화를 강구하는 등의 방법을 통해 취약점을 극복하는 데 노력을 기울여야 한다."
7584,산업동원,"산업형태를 평시활동으로 부터 국가적 군 지원 목적에 부합되게 변형하는 것을 가리킨다. 물자, 인력, 자본, 생산과정, 설비 등의 동원은 물론, 기타 산업 프로그램에 필수적으로 기여할 수 있는 요소와 서비스 등을 포함한다."
7604,살상지대,"1. 지형과 장벽을 이용하여 적을 불리한 상황으로 유인하거나 집결을 강요한 후 병력, 화력 및 장벽 등 각종 수단으로 적을 격멸하기 위해 사전에 계획된 지역을 가리킨다. 주로 방어시에 운영하며, 특정지역을 무력화시켜 기동부대의 통로를 개척하기 위해 운용되기도 한다.  2. 공군에 있어서는 대 지상화력을 집중하기 위해 설정된 3차원공간상의 한 지역을 가리킨다. 적 목표물의 집중이 예상되는 곳에 선정되는데, 이는 지상군 지휘관의 기동계획과 전방 정보보고를 바탕으로 수립된 기계획 표적 및 표적지역으로서 화력지원협조선(FSCL)넘어서의 공역통제수단이다. 이는 전방항공통제관(FAC)의 직접통제가 이루어지지 않는 상태에서도 아군의 항공전력이 우군에 피해를 주지 않고 적을 공격할 수 있는 지역을 설정하는 데 그 설정목적을 두고 있다."
7698,상륙일시,"상륙일(D-day) 및 상륙시(H-hour)를 아울러 부르는 말. 일반적으로 D-day 및 H-hour는 작전계획상의 공격예정일 및 그 시각을 가리키며, 상륙작전에 있어서도 본질적으로는 같은 의미로 쓰이는데, 그 일시를 특정짓는 기준은 다음과 같다. 상륙일은 상륙작전시 최초지시의 목표일자에 명시되어 있는 대략적인 상륙개시 일자를 가리키는데, 잠정상륙일은 상륙기동부대의 사령관이 계획수립단계 초기에 발표하는 것이 일반적이며, 특정한 상륙일(D-day)은 상륙기동부대 사령관과 상륙군 사령관의 협의 하에 선정된다. 또한, 상륙시(H-hour)는 해상함안 이동단계에서 최초 돌격파가 해안에 상륙하는 시각을 가리키는데, 계획수립단계에서의 H-hour는 기계획된 최초 돌격파 상륙하는 시각이나, 실시단계에서의 H-hour는 실제로 상륙이 이루어지는 시각을 의미한다. 헬기 수직돌격 및 보조작전 등의 경우에는 L-hour와 같은 다른 문자를 사용한다."
7699,상륙작전,"해군 및 공군의 지원을 얻는 상륙군이 해양을 통하여 적 해안에 지상군(육군 및 해병대)을 상륙시키는 공격작전을 가리킨다. 상륙작전의 목적은 차후 전투작전수행을 위한 적 해안지대에서의 교두보 확보 및 그를 통한 적 종심지역의 주요목표 공격 및 교란, 해군 전진기지 및 공군기지의 확보, 목표지역 혹은 당 지역에 위치한 시설을 적이 사용하는 것을 방해하는 것 등이다. 상륙작전의 성공적인 수행을 위해서는 가능한 한 최대한의 작전의도 은폐를 통한 기습효과를 얻는 것이 매우 중요하며, 적이 강력한 해안 방위선을 구축했을 경우에는 해상에서의 함포 지원사격 및 공중폭격이 거의 필수적이며, 때로는 상륙부대에 앞서 공수부대가 적 해안방위선 후방에 침투하여 교란작전 등을 벌이기도 하는데, 이러한 지원 해군 및 공군과 상륙군과의 유기적인 협조 역시 상륙작전의 성공을 위한 중요한 요소이다."
7700,상륙장갑차,"상륙작전과 지상작전을 동시에 수행할 수 있도록 만들어진 수륙양용의 상륙차량을 가리킨다. 사용용도에 따라 병력을 수송하는 상륙장갑 인원수송차, 상륙돌격시의 지휘용 차량인 상륙장갑 지휘차, 야전정비능력을 갖추고 정비 및 수리 임무를 주로 맡는 상륙장갑 구조차로 분류된다. 한국군에서 운용하는 상륙장갑인원수송차로는 1973년부터 도입된 LVTP-7과 1986년부터 도입된 그 개량형 LVTP-7A1 및 1998년 말부터 실전배치된 KAAV-7A1이 있다. 3기종 모두 모두 3인의 승무원을 비롯하여 25명의 인원을 수송할 수 있으며, 시속 13km대의 수상속도를 가지고 있다. 상륙장갑 지휘차로는 LVTC-7을 운용하고 있는데, 인원 수송능력은 9명으로 적은 편이나 11개의 UHF, VHF 통신설비를 갖추고 있어 22개망의 구성이 가능하다. 상륙장갑 구조차로는 구난차량인 AAVR-7을 운용하고 있으며, UHF 2개 망을 갖추고 있다."
7705,상륙전기함,"상륙작전의 진행과정에서 지휘관이 탑승하여 작전통제를 행하는 함선을 가리킨다. 이 함선은 주로 상륙군의 상륙 및 지원임무를 담당하는 해상, 수중 및 공중부대를 통제하기 위한 통신소요를 충족시킬 수 있도록 지휘지원시스템을 갖춘 형태로 설계되어 있으며 상륙작전을 지원하기 위한 항공, 기상 사진 및 지도복제, 장비, 계획수립 등의 지원시설을 제공하기도 한다. 한국군은 2007년 완성을 목표로 2002년부터 1만톤급의 상륙지휘함인 LPX 건조를 2002년부터 추진하고 있다."
7706,상륙주정,"상륙용 함정 중에서 기준배수량 500t 이하인 것들로 부대 및 장비의 수송, 접안, 하역 및 철수용으로 특별히 건조된 상륙전용 주정을 가리킨다. 해안까지 이동(비칭:beaching)한 뒤 선수(船首)로부터 해안으로 경사진 판(바우 램프:bow lamp)을 내려 병력을 상륙시키는 재래식 상륙주정의 경우 크기에 따라 LCU(landing craft utility:대형 상륙용주정), LCM(landing craft mechanized:중형 상륙용주정), LCVP(landing craft vehicle and personel:소형 상륙용주정)로 나뉘며, 한국군에서는 2002년 기준으로 수송능력 200t의 물개급 LCU 및 수송능력 55t의 LCM8급 LCM 및 LCVP를 운용하고 있다. 근래에는 초수평선 너머 공격을 위한 공기부양정이 주목받고 있는데, 미군의 LCAC가 대표적이며, 한국군도 솔개 공기부양정을 개발하였다가 1998년 이후 LPX사업이 거론되면서 미군 LCAC의 면허생산 쪽으로 방향을 바꾼 바가 있다."
7709,상륙함정,"상륙용 함정 중 상륙주정보다 대형으로, 장기 항해와 해안에의 신속한 양륙을 위하여 설계된 돌격함선을 가리킨다. 대량의 전차 및 상륙주정을 수송하는 LST(landing ship tank:전차상륙함), 탑재하는 상륙용주정을 크레인으로 착수(着水)시키는 LKA(landing cargo ship:상륙용수송함), 함정에 설치된 독으로부터 상륙용주정을 부상, 발진시키는 LPD(amphibious transport dock:독식 상륙수송함), LSD(dock landing ship, 독식 상륙함), 항공기용 발함, 착함갑판을 갖추고 헬리콥터나 수직이착륙기의 운용이 가능한 LPH(landing helicopter assault:헬리콥터상륙함선), LHA(amphibious assault ship:강습양륙함) 등이 있다. 단, LPD, LSD 중에서도 헬리콥터 운용은 가능한 함선이 있다. 통신 및 전투 정보의 기능을 강화시킨  LCC(amphibious command ship:상륙전기함)도 상륙함선의 범주에 포함된다. 미군은 위에 열거한 함선 모두를 보유했었거나 보유하고 있으나, 한국군의 경우는 2002년 기준으로 차랑 700톤과 상륙정 200톤을 수송할 수 있는 고준봉급 LST와 전차 20대 및 LCVP 2대를 탑재할 수 있는 구형 LST만을 운용하고 있으며, 현재 LPX급 강습상륙함을 도입 예정중이다."
7846,생물학무기,"바이러스나 세균을 위시한 생물학 작용제를 이용하는 무기의 총칭. 대상은 사람 외에도 가축을 비롯한 동물이나 작물을 비롯한 식물 등도 포함하며, 생물학무기의 운용에는 단순한 살상 뿐 아니라 무능화 및 음식물과 보급품 등을 변질시켜 이용하지 못하게 하는 목적도 있다. 대개 지효성을 띠고 있어서 일반적으로 화학무기나 핵무기에 비하여 효과가 늦게 나타나는 편이나, 화학무기에 비해서는 지속성이 강한 편이다. 생물학 무기의 사용 역사는 전염병으로 죽은 가축이나 사람의 시체를 적진에 투석기로 던져 넣었던 서양 중세시기까지 거슬러 올라갈 수 있으며, 현대의 대표적인 생물학 무기로는 탄저균, 천연두균, 보톨리눔 독소, 황열병 바이러스 등을 들 수 있다."
8155,세력균형,"국제사회에서 특정한 한 국가가 단독으로 주도권을 잡는 것을 견제하고 서로 상대국가를 쉽게 공격할 수 없는 상황을 만들어 전쟁을 방지하고 국제사회의 평화와 안정을 추구하는 것, 혹은 그러한 힘의 균등상태를 가리킨다. 이는 일반적으로 군사력의 균형이라는 형태로 나타난다. 세력균형을 추구하는 상황 아래에서 각국은 자국의 이익을 추구하면서 독립적으로 군사력의 증감이나 외교적인 활동을 행하지만, 기본적으로 단일한 패권국이 국제 사회에 나타나 균형을 깨는 일에 대해서는 국가간의 협력을 통해 그에 상대하는 세력을 이루어 막는 방향으로 움직이게 된다."
8174,세열폭탄,"폭탄의 표면에 홈을 파 파편에 의한 인마살상능력을 높인 폭탄을 가리킨다. 이 폭탄은 지상물의 파괴보다 적의 인마살상을 주목적으로 하는데, 일반적으로 폭탄의 경우 폭발시의 열보다는 폭발로 인한 폭풍과 비산하는 파편이 그 살상능력의 많은 부분을 차지한다. 세열폭탄은 미리 폭탄에 홈을 파 두어 폭발시 그 파편이 미리 파 놓은 홈에 따라 잘게 갈라질 수 있게 만든 것으로, 이로 인해 재래식 폭탄에 비해 파편효과가 크게 증가하여 강력한 인마살상능력을 지닌다. 현재 군에서 쓰이는 인마살상용 수류탄 역시 세열수류탄으로, 세열폭탄의 일종이다."
8415,쇼우다운계획,"한국전쟁기간 중 교착상태에서 전투가 계속되던 1952년, 적군의 연속적인 공세로 주도권이 넘어가고 있는 상황을 우려한 미 제 8군 사령관 밴플리트 장군이 10월 초 유엔군 사령관 클라크 장군에게 제안하여 실행된 작전. 금화 북쪽의 감제지역을 확보하여 금화부근의 방어선을 개선하기 위한 제한된 공격작전으로, 포병지원과 항공기에 의한 공습지원이 뒷받침되는 가운데 2개 대대를 투입하여 200명 이내의 사상자로 5일 이내에 작전을 완료할 수 있다는 예측 하에 휴전협상이 결렬된 10월 8일 클라크 장군으로부터 승인을 받아 저격능선과 삼각고지를 목표로 10월 14일 공격을 개시하였다. 그러나 작전의 진행은 예상보다 매우 지지부진하였고, 공격에 투입되었던 미 제 7사단은 예하 9개 보병대대 중 8개 대대를 투입하여 2,000명 이상의 사상자를 내는 피해를 입었다. 11월에 접어들면서 전투는 소강상태로 들어갔고, 결국 42일간의 작전 끝에 저격능선만 확보한 상태에서 작전은 종료되었다."
8523,수복지역,"1. 아군측의 영토로서 적에 의하여 점령되어 있다가 아군 또는 우방국에 의하여 적을 축출하고 탈환된 지역을 가리킨다. 본래의 치안조직 등을 회복시키고 안정시키기 위한 정책이 행해지는 것이 일반적이다.  2. 수복지역내소유자미복구토지의복구등록과보존등기에관한특별조치법상에서는 북위 38도 이북의 수복지역(동지구의 행정구역에 편입되는 북위 38도 이남지역을 포함한다)과 경기도 파주군 장단면, 군내면, 율서면 및 율동면의 지역을 가리킨다"
8576,수송동원,"전시에 인원이나 물자 등의 수송을 원활하게 지원하기 위하여 모든 수송수단과 그에 관련된 업체를 동원하는 것을 가리킨다. 동원대상에는 차량, 선박, 항공기 등의 장비 외에도 그것을 운용 및 보수, 유지하는 운송업체, 정비업체, 콘테이너업체, 항만하역업체 등이 포함된다."
8685,수중익선,"배의 밑바닥에 수중날개를 단 배를 가리킨다. 1906년 이탈리아에서 최초로 실험선이 만들어졌으며, 실용선으로는 1952년 스위스에서 처음 등장하였다. 처음에는 선체의 부력으로 물 위에 떠 있으나 속력이 증가함에 따라 수중날개가 양력을 얻어 차차 선체가 상승하게 되고, 일정 이상의 속력이 되면 선체는 수면에서 떨어진 상태로 수중날개와 추진기만이 물 속에 남게 된다. 이렇게 하여 물의 저항을 크게 줄일 수 있기 때문에 같은 엔진 출력으로도 일반 선박에 비해 약 3배까지의 고속 운항이 가능하다. 양력을 얻는 원리는 항공기와 동일한데, 물의 밀도가 공기보다 약 800배 정도 높기 때문에 비교적 낮은 속력과 작은 날개로도 충분한 양력을 얻을 수 있다. 그러나 선체가 대형화될수록 필요한 날개의 크기가 커지기 때문에 현재로서는 일반적으로 배수량 약 500톤 정도가 실용한계이다. 날개의 형식에 따라 고속운항시 수중날개의 전부가 물 속에 잠기는 전몰형과 수중날개의 일부가 수면 위에 나오는 반몰형으로 나뉘어진다."
8711,수직이착륙 항공기,"활주로를 필요로 하지 않고 수직으로 이착륙할 수 있는 항공기를 가리킨다. 넓게는 회전익 항공기를 포함하나, 일반적인 의미로는 고정익 항공기로서 수직이착륙 능력을 지닌 것만을 가리킨다. 고정익 항공기가 수직이착륙을 행하기 위한 방법으로는 회전익기와 고정익기의 중간형태로서 이착륙시와 비행시의 로터 방향을 바꾸어 수직이착륙을 행하는 틸트로터 방식과 기본 엔진 외에 수직이착륙을 위한 엔진 또는 리프트 팬을 따로 설치하는 방식 및 이착륙시와 비행시의 노즐 방향을 바꾸어 수직이착륙을 행하는 추력편향 방식이 있다. 상륙작전 등의 제한적 용도에서 높은 효과를 발휘하나, 수직이착륙시 연료 소모가 심하여 작전반경이 짧아지고 무장탑재가 빈약해지는 단점이 있어 보통의 경우에는 단거리이착륙(STOL) 항공기로 운용하다가 필요시에만 수직이착륙 기능을 사용하는 것이 일반적이다. 현재 운용되고 있는 수직이착륙기능 보유 군용기로는 별도 엔진을 이용하는 러시아의 포저, 추력편향 방식을 사용하는 영국(미국에서도 운용)의 해리어/시 해리어 및 틸트로터 방식을 사용하는 미국의 오스프리가 있다"
8759,수포작용제,"노출된 피부와 들이마신 폐에 손상을 주어 살상효과를 일으키는 화학무기의 한 종류이다. 상당한 지속성을 지니고 있어서 지형 사용의 제한 및 물자나 시설 사용의 방해를 위해 사용되기도 한다. 신경 작용제와 더불어서 실전용으로 가장 유용하다고 인정받고 있는 화학무기이다. 강한 마늘 냄새가 나며, 액체나 증기의 형태로 작용제에 노출된 피부나 안구에 서서히 붉은 반점과 수포를 발생시키거나 조직 파괴를 유발시키며, 작용제의 증기가 호흡을 통해 폐에 들어갈 경우 폐에도 손상을 준다. 대량의 증기에 호흡기가 심하게 노출된 경우 1-2주일 사이에 사망하기도 한다. 세계대전 당시 독일군이 이용했던 유황계 수포 작용제인 겨자 가스(H)가 수포 작용제의 시초이며, 이외에 질소계 수포 작용제(HN-1,2,3), 루이사이트 작용제(L), 혼합형 수포 작용제(HT, HL), 포스겐옥심 작용제(CX) 등이 있다. 특히 포스겐옥심 작용제는 다른 수포 작용제와 달리 노출 즉시 통증을 주며, 가장 강력한 자극성 물질 중에 하나이다. 수포 작용제에 노출되었을 경우의 응급처치에는 KM258A1 제독키트를 이용하며, 피부는 따뜻한 비누물에, 눈은 깨끗한 물에 씻고 안정을 취한다."
8802,순항미사일,"제트엔진을 이용하여 비행하는 비교적 저속의 미사일을 가리킨다. 발사초기단계에서 로켓 추진체로 속도를 얻기도 하나, 목표물에 도달하기 위한 비행 자체의 대부분은 제트 엔진에 의해 이루어진다. 그 원조는 제 2차 세계대전 말기에 독일에서 개발되었던 V1 미사일이다. 음속 이하로 비행하기 때문에 초음속으로 비행하는 탄도미사일에 비하여 목표물에 도달하는 속도가 느리고 일단 발견되면 전투기나 기타 대공수단에 의한 요격하는 것이 탄도미사일에 비하여 용이한 편이지만, 초저공 비행이 가능하기 때문에 탄도미사일에 비하여 레이더가 포착해 내기 어렵다. 저공 순항비행 및 목표유도를 위해서는 해상 비행시에 사용되는 시 스키밍 방식과 미리 입력된 지도와 레이더로 감지한 지형을 대조하여 진로를 수정하는 지형등고선대조(Terrain Contour Matching:TERCOM), 최종유도에 쓰이는 디지털 목표대조 시스템(Digital Scene Matching Area Correlation:DSMAC) 및 관성유도방식 등이 복합적으로 사용되며, GPS 유도를 사용하기도 하는데 순항미사일에 사용되는 GPS 코드는 C/A코드보다 정밀한 군용의 P코드를 사용하여 명중률이 높다. 대표적인 순항미사일로는 미국의 토마호크(Tomahawk) 및 하푼(Harpoon) 등을 들 수 있다."
8803,순항속도,"항공기가 연속적인 비행을 할 때 취해지는 속도를 가리킨다. 이는 엔진내구성, 연료소모율, 두 지점간의 소요시간, 기상상태, 기체의 총 중량 등을 종합하여 결정되는데, 이를 결정하는 방식으로는 일정한 속도를 지속적으로 유지하면서 경제적인 비행을 할 수 있는 최적속도인 고속순항방식과 단위연료 당 비행거리가 최대가 될 수 있도록 연료상태에 따라 속도를 조절하여 가장 연료를 절약할 수 있는 장거리순항방식이 있다"
8810,스냅작전,"한국전쟁기간 중인 1950년에 실시되었으며, 미국으로부터 한국으로 수송중인 보급품과 한국에서 후송되어 오는 보급품을 일본에 수령하여 보관하는 작전이었다. 한국으로 수송중인 함정들은 일본으로 회항되어 그 선적물품을 다양한 저장지역에서 하역하였다. 12월 15일부터 작전이 시작되어 12월말까지 한국에서 후송되어온 18,957톤의 보급품 및 일본으로 회항되어온 107,047톤의 보급품이 일본의 고꾸라, 고시엔, 사세보, 고베 등지에 저장되었다. 이 작전은 1951년 1월에도 계속되었으나 1월말에 일어난 전술상황의 변화로 일본으로 후송되어오는 군수품 양이 감소되었다. 작전의 결과로 미 제 8군 보급창의 비축분은 15일 수준을 유지하였으며, 한국에 대한 보급품 수송도 이 수준을 유지할 수 있도록 선별적 기준에 의해 공급되었다."
8833,스마트탄,"정밀유도 병기의 한 가지. 폭탄에 유도장치를 부착하여 명중률을 높인 것을 가리킨다. 유도장치로는 목표물에 레이저를 조사하여 폭탄을 유도하는 레이저 유도방식과 텔레비전 카메라를 이용하여 유도를 행하는 방식이 있다. 재래식 폭탄에 유도장치를 장착하여 스마트탄으로 개량하기도 한다. 정밀폭격을 행하는 데 있어 매우 중요한 무기로서, 일반적인 폭탄에 비하여 명중률이 높으므로 목표물의 파괴에 소비되는 폭약의 양을 그만큼 줄일 수 있으며 오폭에 의한 피해 및 폭격의 정밀도 부족에서 비롯되는 부수적인 피해도 줄일 수 있다."
