순번,Q,A
3492,낙동강 오리알,"6.25 당시 국군들이 인민군을 조롱하는 의미로 널리 사용되던 말이다. 현재는 원래의 무리에서 떨어지거나 뒤처져 처량하게 남게 된 신세를 비유하여 이르는 말로 쓰이고 있다. 이 말이 처음으로 생긴 것은 낙동강 방어작전 때였다. 1950년 8월 4일, 국군과 유엔군이 낙동강 방어진지를 점령하고 방어작전을 수행하던 낙동강변 낙동리(낙정리)에 배치된 국군 제1사단 12연대 11중대 앞에는 1개 대대 정도의 인민군이 낙동강을 건너기 위해 필사적인 도하를 시도하고 있었다. 격렬한 총격전이 계속되던 와중에 유엔 항공기에서 네이팜탄을 퍼부어 적 진지를 불바다로 만들어 버렸는데, 이때 항공기에서 떨어지는 포탄과, 국군의 사격으로 적이 쓰러지는 모습을 바라보던 11중대장(강영걸 대위)은 갑자기 큰 소리로 야! 낙동강에 오리알 떨어진다고 소리쳤고, 병사들은 이에 호응하여 함성을 질렀다. 그 이후 낙동강 오리알이라는 말은 국군이 인민군을 조롱하는 의미로 널리 사용되었다."
3497,낙진,"핵폭발에 의해 생성되어 대기 중으로 낙하하는 미세한 방사성물질을 가리킨다. 지상의 먼지나 파편물에 방사능 물질이 포함된 것이나 핵분열생성물 및 플루토늄의 폭발잔재 등이며, 형태에 따라 그대로 떨어지는 건조낙진, 비에 섞여 검은 비를 만드는 강우낙진, 눈에 섞여 내리는 강설낙진이 있으며, 눈처럼 떨어지는 재의 형태를 한 선낙진과 작고 가벼워 더 높이 올라간 다음 바람을 타고 훨씬 멀리 흩뿌려지는 후낙진으로도 나뉘어진다. 선낙진의 방사능 오염도는 매우 강하여 이에 노출된 사람은 2주 내지 6개월 내에 사망하게 되며, 후낙진은 대기권 높이까지 올라가기 때문에 선낙진에 비해 훨씬 넓은 범위에 퍼지게 된다."
3532,남북 교역장,"38선 설정 이후 한국전쟁 직전까지의 미 군정 시기에 남북간의 물물교환 무역이 허용되었던 장소를 가리킨다. 1947년 5월 미소 군정 당국간의 협의로 군 관리하에서 남북간의 물물교환 무역을 허용하기로 한 것이 시초로, 당시 제 7사단 방어지역 내의 도감포, 꽃봉마을, 추동리 및 영평천 백사장(만세교 북방 4㎞)의 4개소에 교역장이 설치되어 있었으며 매월 2-3회씩 비정기적으로 교역이 실시되었다. 당시 대단히 어려웠던 한국군 재정을 구제하기 위한 의미도 가지고 있었으나, 실질적인 운영에 있어서는 부정과 그에 따른 부작용이 많았다. 1949년 1월 김석원 1사단장에 의해 교역이 일시 중지된 일이 있으며(이른바 명태 사건), 한국전쟁 직전인 1950년 5월 중순, 북한측에서 일방적으로 남북교역을 중단시킴으로서 남북교역장은 폐쇄되었다."
3533,남조선로동당,"1946년 11월 서울에서 조직된 정당. 약칭인 남로당(南勞黨)으로 잘 알려져 있다. 일제시기에 지하활동을 벌이다가 해방 직후 박헌영에 의해 재건된 조선공산당은 남북한 전역에 걸쳐 지부를 재조직하였는데, 45년 12월 북조선분국의 책임비서가 된 김일성이 북조선분국을 조선공산당에서 분리시키고 46년 4월 북조선공산당이라는 명칭으로 서울의 조선공산당으로부터 독립하였으며, 8월에는 조선신민당과 합당하여 북조선노동당(일명 북로당)으로 알려진 조선노동당을 결성하였다. 이에 남한내 좌익세력을 총집결하기 위해 여운형의 제안으로 조선공산당, 남조선신민당, 조선인민당이 합동하기로 하였으나, 각 당의 내에서 합동을 놓고 분열이 일어나 여운형 등은 사회노동당을 결성하였고, 조선공산당의 박헌영 계열이 중심이 되어 남한의 3개 좌익성향 당이 합당하여 11월 남조선노동당이 결성되었다. 그러나 이미 9월 초에 박헌영 등 주요 좌익간부들에 대하여 체포령이 내려지는 등 미군정에 의한 좌익 탄압이 강화되면서 지하조직화 되어갔으며, 몇몇 사건들을 주도하는 사이 대중조직이 무너졌고 간부들은 대부분 검거를 피해 월북하였다. 1949년 6월 남로당과 북로당의 합당으로 조선노동당이 결성되면서 남로당은 사라졌고, 이후로도 북한 초기의 김일성 내각에서 남로당 월북 인사들의 일부가 각료직을 담당하는 등 일정 세력을 유지하였으나 한국전쟁을 거치면서 남한 내의 남로당 조직은 완전히 붕괴되었고 한국전쟁 이후 김일성의 독재강화책으로 인하여 북한 내의 남로당 인사들 역시 대부분 숙청당하였다."
3571,내선작전,"외부의 수개 방향에 적이 존재하는 상태에서 그것을 격파하기 위하여 원심적으로 실시하는 작전을 가리킨다. 내선작전의 본질은 전체의 힘을 결집하여 개개의 목표에 축차적으로 대항하는 것으로, 전투력의 집중과 시간적 요소가 중요하게 작용한다. 내선작전은 일반적으로 전투력이 열세한 측에서 채택하며, 넓게 퍼진 적에 대하여 축차적으로 각개격파를 실시하여 개개의 승리를 누적하고 이를 통하여 전체의 승리를 획득하는 것을 목적으로 하는 작전으로, 예하부대를 집결시켜 장악할 수 있는 장점이 있으며 순조롭게 각개격파가 이루어질 경우 적은 병력으로 승리를 얻을 수 있으나, 병참선이 위협당하기 쉽고 각개격파를 성공시키지 못했을 경우에는 오히려 수동적 포위상태에 빠지게 될 수 있고, 이로 인해 불리한 결전을 강요당하여 치명타를 입을 수 있다. 내선작전에 있어 전투력 집중은 중요하나 원하는 시기와 장소에 집결시킬 수 있는 태세에 두면 될 뿐이며, 부대 자체를 항상 집결시킬 필요는 없다. 내선작전의 성공을 위해서는 분산된 적에 대한 각개격파의 성공이 필수적이며, 이를 위해서는 전기간파와 올바른 목표 선정 등이 가능한 탁월한 지휘통솔 능력과 부대의 높은 기동성-이를 위하여 수송기관을 완비할 필요성이 있다.-이 요구되며, 각개격파를 위한 충분한 거리 확보와 가능한 한 적을 분산시켜 두어야 하는 등의 조건도 필요하다. 또한, 외선에 위치한 적을 각개격파하는 주작전과 주력이 각개격파를 행하는 동안 타방면 적 증원이 주공지역으로 향하지 못하도록 견제하는 지구작전의 균형을 적절히 유지하여야 한다."
3662,노네임선,"한국전쟁 기간인 1951년, 공산군의 공세를 막기 위해 설정되었던 방어선 중 하나. 수색-구파발-금곡-청평-홍천북방-현리-양양북방을 잇는 선으로, 서울 북방을 반원형으로 둘러싸고 한강 북쪽 지역으로부터 청평을 경유하여 홍천강 남쪽을 따라 동쪽으로 뻗어 있고 홍천 북방으로부터 동북진하여 대포리에 이르는 선이었다. 적의 4월공세가 개시되기 전 본래의 미 제8군 작전개념은 공산군의 공격으로 철수를 강요받을 시, 성동리-노고산-덕정-포천-가평을 연하는 델타(Delta)선과 수색-북한산-덕소를 연하는 골든(Golden)선, 그리고 한강-양평-횡성-양양을 연하는 네바다(Neveda)선으로 축차적인 철수를 하면서 공산군에게 최대의 출혈을 강요한 후 반격작전으로 전환하여 다시 캔사스선을 회복하는 것이었다. 이는 경우에 따라서 서울을 포기할 가능성도 있게 되는 계획이었다. 제 8군 사령관 밴플리트 장군은 미 제 1군단의 예하 사단들이 골든선으로 철수하기 직전에 이 작전개념을 수정하여 골든선 동쪽에서 연결되는 네바다선보다 30km내지 40km 북방의 용문산-홍천-한계령-속초를 연하는 새로운 방어선인 노네임(No Name)선을 설정하고 군단간 전투지경선을 일부 조정한 후 골든-노네임선을 방어할 것을 명령하였다. 이것의 전략적 전술적 의미는 매우 중요했는데, 전술적으로는 미 제1군단의 골든선 방어를 우측방에서 지원함은 물론 부득이 철수하더라도 동측방에서 서울을 재탈환할 수 있는 공격의 발판을 확보하겠다는 의도였으며, 전략적으로는 중동부전선 부대가 네바다선 점령을 위해 북한강 이남으로 자발적인 철수를 행할 때의 영토포기를 사전에 방지하는 동시에, 서울의 세 번째 포기로 한국 국민이 받을 심리적인 타격과 손상을 막을 수 있다는 점이었다. 이 선의 이름에 대한 유래는, 특별한 지형상의 중요선을 따른 것이 아니라 일시적인 통제선의 의미가 강했으므로 종전과 같이 지명에 연유하여 이름을 붙일 수가 없었으며, 실은 어느 참모가 선명을 제안하였다고도 하나 밴플리트장군은 &quot그러한 것에 상관하고 있을 때가 아니다. 노네임으로 충분하다&quot고 꾸짖어 그대로 노네임선이라 불리게 되었다고 한다."
3717,농축우라늄,"천연 우라늄에 가공을 가하여 우라늄 235의 함유율을 인위적으로 높인 우라늄을 가리킨다. 핵분열 반응에 이용할 수 있는 것은 우라늄 235인데, 본래의 천연 우라늄은 우라늄 235의 함유율이 0.7%에 불과하며, 나머지 대부분은 우라늄 238로 구성되어 있다. 따라서 원자력발전이나 핵무기 등에 사용될 수 있을 정도의 핵분열 반응을 일으키기 위해서는 우라늄 235의 함유율을 좀더 높일 필요가 있다. 발전소에 흔히 쓰이는 경수로의 경우 우라늄 235의 함유율을 약 3%까지 농축시킨 것이며, 그 함유율이 20%이상인 우라늄을 특별히 고농축 우라늄이라 부른다. 핵무기에 사용되는 우라늄은 우라늄 235의 함유율이 90%이상인 고농축 우라늄이다. 우라늄의 농축에는 기체확산법, 가스확산법, 원심분리법, 노즐법, 화학교환법, 레이저법, 열확산분리법 등이 사용된다."
3802,다련장로켓,"다수의 로켓탄 발사기를 상자형이나 원통형으로 배열해 한데 묶어 놓은 것으로, 차량에 탑재하여 자주화하는 경우가 많다. 수 기에서 수십 기의 로켓을 한꺼번에 발사하여 동시에 대량의 화력을 집중시키는 목적으로 하며, 광역제압, 살포지뢰 투하, 대포병사격 등에 쓰인다. 북한의 경우 각종 구경의 다연장 로켓포에 방사포라는 명칭을 붙여 다수 운용하고 있으며, 한국의 경우 국산인 구룡 다연장 로켓포를 비롯하여 MLRS(Multiple Launch Rocket System)와 MLRS 발사대를 사용하는 광역제압용 단거리탄도탄인 ATACMS(Army Tactical Missile System)를 도입하여 운용하고 있다."
3876,다중채널 무선통신,"초단파(VHF) 이상의 주파수를 사용하는 무전기와 반송장비 등을 사용하여 다중통신 회로를 구성하는 방식을 가리킨다. 부대간에 신속하게 많은 회선을 제공할 수가 있으며 중계통신소를 설치 운용하여 통신거리를 연장할 수 있으나, 다중채널 무선통신은 지형의 장애를 받으며 적에 의한 도청과 전자방해를 받기 쉽기 때문에 무선통신에 준하여 보안에 유의하여야 할 필요가 있다."
3877,다중통신,"한 통신 전송로의 회선을 사용하여 다수의 신호를 동시에 전달함으로써 수많은 통신을 구성하는 유선 및 무선 통신방식을 총칭하여 가리킨다. 이는 전송매체, 즉 통신회선을 최대한 유용하게 이용하여 경제적으로 신호를 전송할 수 있다는 장점이 있다. 다중통신을 위한 방법으로는 각 통신가입자마다 주파수대역을 달리 할당하여 전송하는 주파수분할다중통신과 복수의 신호를 각각 다른 시간에 전송하는 시분할다중통신의 두 가지 방법이 있다."
3905,단거리 대공무기,"일반적으로 저고도로 침투하는 적의 고정익 항공기나 헬리콥터 등을 요격하기 위하여 운용되는 대공무기로서, 중거리 및 장거리 지대공 미사일 체계에 비하여 최근에 개발된 것들이다. 비행장 및 지휘통제 시설(C2)과 같은 중요한 전략적 목표물의 다중 대공(layered air-defence)체계 등에 없어서는 안 될 부분이며, 지상군의 대 항공방어 능력을 크게 향상시켰다. 단거리 대공무기체계로는 대공포나 휴대용 단거리 대공미사일이 대표적이며 , 단거리 대공미사일을 차량에 장착하여 기동성을 높인 경우도 있다. 보통 10km이하의 사정거리를 가진다. 1980년대에 소련군이 아프가니스탄을 침공했을 때, 미국은 아프가니스탄의 무자히딘에 레이시온사의 FIM-92 Stinger 단거리 지대공 미사일을 제공하였고, 이것은 소련 항공기에 대하여 막대한 전과를 올린 바 있다."
3910,단거리 수직이착륙기,"단거리 이착륙(Short takeoff landing)과 수직 이착륙(Vertical takeoff landing)을 모두 행할 수 있는 항공기를 가리킨다. 이와 같은 능력을 가진 항공기가 활주 이륙을 하게 될 경우 수직이착륙을 행할 때보다 날개의 양력이 증가되기 때문에 유효탑재량을 크게 증가시킬 수 있으며 이륙시의 연료소모가 줄어들기 때문에 전투행동반경이 좀더 넓어지게 되는데, 이로 인해 이러한 능력을 갖춘 항공기는 일반적인 경우 단거리 이착륙을 행하며, 작전상 필요할 경우에만 수직이착륙을 행한다. 영국, 미국 등에서 경항모용 함재기로 사용하는 시해리어가 대표적인 단거리 수직이착륙기이다"
3930,단대호,"단위부대부호의 준말. 부대의 규모나 종류를 알려주는 정보를 담고 있는 부호를 말한다. 한국군 역시 나토 표준과 거의 다르지 않은 단대호 규칙을 사용하고 있다. 나토 표준에 따른 일반적인 형식은 직사각형 안에 병과 및 임무를 나타내는 표시가 그려넣어지고, 왼쪽에 단위부대명, 오른쪽에는 직속 상급부대명을 낮은 것부터 기입한다. 위쪽에는 소대, 연대, 사단 등의 부대 규모를 나타내는 부대단위부호가 그려지고, 아래쪽에는 각종 전술기호나 부대 장비등의 추가 정보가 기입된다."
4027,대 도시목표가격,"적국의 사회조직에 대하여 심대한 파괴를 가할 목적으로 직접 적의 산업 및 인구중심지(도시)에 핵공격을 가하는 것을 가리킨다. 이러한 공격 및 공격전술은 일반적으로 두 가지 경우로 설명되는데, 첫째는 제 2가격으로, 적국의 제 1가격에 의해 타격을 받은 나라가 잔존무기로 소수의 전략핵미사일을 가지고 있을 경우, 또는 적의 가격군이 그 제 1가격에서 대부분 쇠진되었거나 적에게 제 2가격이 알려지지 않고 있을 때이며 일반적으로 적의 기습적 선제공격에 대응하는 전략으로서의 의미를 가진다. 두 번째는 최소억제전략의 일환으로 적의 도시를 목표로 하는 취약성 적은 소수의 핵미사일을 보유하고 있으며 적의 침략을 억제하는 데 충분하다는 의견에 의해 대 도시목표 가격이 지지되는 경우이다."
4035,대 병력전략,"핵전략의 한 가지로, 인구가 집중된 도시는 피하고 핵병력을 비롯한 적의 군사력을 목표로 하여 적의 핵보복력을 파괴하는 전략을 가리킨다. 이를 위해서는 핵병기의 질과 양이 모두 충실해야 하므로 대량의 핵탄두와 운반장치 및 높은 명중도를 위한 고도의 기술이 필요하며, 목표로 삼은 핵병력을 비롯한 적의 군사물의 배치에 대한 정확한 정보가 필수적이다. 1960년대 초에 미국의 맥나마라 국방장관에 의해서 처음 제창되었고, 이후 소련측의 핵전력이 증가함에 따라 대 도시전략을 비롯한 확증파괴전략을 통하여 상호억제를 이루는 방향으로 선회하였다가 70년대에 들어서 다시 전략병력을 선택적으로 공격하는 목표선택전략이라는 대 병력전략을 채택하였다."
4077,대게릴라전,"대비정규전의 일부로, 아군 지역에 침투하여 유격전을 실시하고 있는 적 게릴라를 소탕 및 격멸하고 그 재발을 방지하기 위한 활동을 가리킨다. 가능한 모든 수단을 사용하여 적의 인적, 물적 지원 형성을 방해하여 적 게릴라의 안정을 방해하고 균형을 파괴하는 동시에, 적 게릴라를 발견하여 고착포획시킨 후 그 병력을 섬멸하고 게릴라 활동의 근거지를 파괴하는 활동을 행하는 타격작전과 적 게릴라 소탕으로 최초통제를 이룩하고 저항운동의 재발을 방지하여 군, 관, 민의 협조하에 지역의 통제와 안전을 회복시키는 평정작전으로 나누어진다"
4105,대공무기,"적의 항공전력에 대항하여 공격을 행하는 무기를 가리킨다. 적의 항공기 및 비행체 등의 공중전력에 대하여 공격을 가하여 파괴 혹은 무력화시키거나 그 공격효과를 감소시키는 역할을 하는 것으로 기관포와 미사일 등이 주로 사용되며, 무기를 설치, 운용하고 발사하는 위치에 따라 공대공, 지대공, 함대공 무기로 나뉜다."
4113,대공제압,"아군의 항공작전에 방해요소가 되는 적의 대공방어체제를 무력화시키는 것을 가리킨다. 공세제공 작전의 일환으로 실시되기 때문에 공세제공작전의 임무형태로 보기도 하나, 일반적으로는 제공작전을 구성하는 하부작전으로서 공세제공 및 방어제공과는 분리하여 분류한다. 이는 다시 직접 지상목표를 파괴하는 대공제압 타격임무와 대공제압 타격임무를 수행하는 항공기를 보호하는 대공제압 호위임무로 나뉘어진다. 대공제압 타격임무의 수행은 주로 헌터-킬러 방식으로 이루어지는데, 이는 레이더파 탐지장비와 대레이더 미사일을 장비한 헌터역 항공기가 대공포와 미사일의 조준 및 발사에 사용되는 레이더 안테나를 무력화시키면 지상공격용 폭탄으로 무장한 상태로 후속하는 킬러역 항공기가 기타 레이더시설 및 대공미사일, 대공포 진지 등에 공격을 가하는 방식으로 이루어진다. 레이더 안테나를 우선 무력화시키는 이유는 무기의 조준 및 발사에 이용된다는 점 외에도 대공포와 미사일보다는 직접 전자파를 방사하는 레이더 시스템 쪽이 탐색 및 발견을 행하기가 용이하기 때문이다. 레이더를 무력화시키는 방식으로는 공대지 미사일 등으로 직접 물리적 타격을 가하는 하드 킬(hard kill)방식과 전자장비를 이용하는 소프트 킬(soft kill)방식이 있는데, 소프트 킬 방식은 전자전에 속하는 영역으로 전투기가 이를 수행하는 일은 거의 없으며 일반적으로 전투기가 대공제압 임무를 통해 행하는 레이더 무력화 방식은 하드 킬이다. 또한 후속 부대로 기타 시설을 파괴하는 이유는 안테나만 파괴시켰을 경우 안테나 교환으로 간단히 레이더 기능이 회복되기 때문에 안테나 파괴만으로는 공격효과를 지속시킬 수 없기 때문이다. 대규모 공격편대군에서 대공제압 임무를 수행하는 항공기는 아군의 공격편대 선봉에서 가장 먼저 진입하여 대공망을 무력화시킴으로써 적의 대공망으로부터 아군의 후속 공격편대군을 엄호하는 역할을 수행한다."
4116,대구폭동사건,"미군정기인 1946년 10월 경찰과 시민들간의 충돌로 대구에서 시작된 유혈사건을 가리킨다. 1946년 9월의 총파업 기간 동안 대구지역의 좌익세력은 대중시위를 전개했고, 10월 1일 대구 40여개 공장노동자들과 학생 및 시민들이 식량배급, 임금인상, 미군철수 등의 구호를 외치며 대규모적인 가두시위에 돌입하였다. 이에 밀린 경찰이 시위대에 발포하여 1명의 사망자가 발생하였고, 이에 군중들은 철야 항의시위를 계속하였고, 다음 날인 2일에도 집회는 계속되었으나 경찰이 다시 발포하여 사상자가 발생하자 시위가 급격히 폭력화되어 경찰서 습격, 무기 탈취, 유치장 개방 등을 벌였고 시내의 파출소를 점거하였으며, 이 과정에서 경찰이 다수 사망하였다. 이에 미군정이 저녁 6시를 기하여 대구지역에 계엄령을 선포하고, 미군 및 중앙 경찰병력을 동원하여 대구를 제압하였다. 대구내의 사태는 이것으로 일단락되었으나, 이후 경북 각 지역에 시위가 퍼져나가 1946년 말에야 진정되었다. 이 사건의 여파로 대구지역의 우익테러가 증가하였고, 9월 총파업에서부터 이 사건까지를 비롯한 일련의 사태로 인하여 남로당 간부를 위시한 좌익세력은 많은 이들이 검거되거나 잠적하여 그 세력이 크게 약화되었다."
4153,대내심리전,"군사적인 의미로는 기본적으로 아군의 부대원들을 대상으로 하는 심리전을 가리키며, 방어심리전과 유사한 개념이다. 이는 부대원들에게 전쟁의 목적을 명확히 이해시키고 단결력을 높이며 상대의 심리전에 오염되지 않도록 하기 위한 목적을 가지고 있다. 이를 위한 활동으로는 정신무장을 위한 정훈 및 홍보활동을 들 수 있으며, 적 심리전의 영향을 사전에 차단하기 위한 불온문서의 침투 저지 및 유무선 통신의 검열 등을 포함한다. 또한 민간에 대하여 실시하기도 한다. 국가가 자국민에 대하여 대내심리전을 실시하기도 하는데, 이를 행하는 방법으로는 국가의 주도로 국내에서 국민정신을 통합하기 위해 실시하는 홍보 및 선전활동 등을 들 수 있으며, 독재국가에서 종종 일어나는 독재자 우상화 활동의 경우도 자국민을 대상으로 하는 대내심리전의 한 예라 할 수 있다."
4173,대량보복전략,"냉전 초기의 미국 핵전략을 가리킨다. 한국전쟁 직후 아이젠하워가 제시한, 국방정책의 기본방침인 뉴룩전략(New-Look Strategy)에서 제시된 것으로, 이 전략에 따르면 핵무기를 중심으로 한 강력한 보복력을 과시하여 적의 전쟁의지를 억제하고, 이를 위해 핵무기를 사용하는 전략공군을 확충하는 한편 기타의 불필요하다고 여겨지는 재래식 전력은 감축하게 된다. 방위적 군사태세로, 상대의 선제공격이 있을 시 핵무기에 의한 파멸적인 보복을 각오하게 하여 상대의 침략의지를 꺾는 것을 목적으로 하였으나, 뉴룩전략에 따른 대량보복전략은 적 공격에 대한 대응수단을 전략핵무기에 한정하기 때문에 공격에 대한 대응 자체가 전면전이 아니면 완전한 전쟁 포기를 의미하는 것이 되어 제한전 및 국지전의 발생을 막지 못했고 그에 대한 대처에 실패하여 핵무기만이 아닌 재래식 병력도 상황에 따라 사용한다는 유연반응전략으로 대체되었다.  2. 어떠한 형태의 군사적 도발에 대해서도 최대 수준의 군사적 응징으로 보복하는 전략, 혹은 그러한 의사를 표현함으로써 상대방의 군사적 도발 의지를 꺾는 억지전략을 가리킨다. 이러한 의미의 대량보복전략을 수행하는 수단은 크게 핵을 비롯한 대량파괴무기를 사용하는 방법과 대규모의 재래전 무기를 사용하는 방법이 있다. 현재 국가방위에 있어 이러한 의미의 대량보복전략을 채택하고 있는 대표적인 나라로는 이스라엘을 들 수 있다."
4174,대량살상무기,"대량 파괴병기라 불리기도 한다. 핵병기, 화학병기, 생물병기를 일괄하여 부르는 호칭으로, ABC(NBC)병기와 같은 의미이다. 핵병기가 최초로 전장에 투입된 제 2차 세계대전 이후에 그 분류가 발생하였으며, 무기의 비인도성 및 대량 살상능력으로 인하여 현대의 군축 움직임에서 중요한 의제가 되고 있다."
4187,대리전쟁,"한 국가가 자국이 직접 전쟁을 치르지 않고 자국의 동맹국이나 우방국 혹은 기타의 다른 나라가 대신 치르게 하여 벌어지는 전쟁을 가리킨다. 제 2차 세계대전 이후 냉전시대에 들어오면서 사용되기 시작한 단어이나, 대리전쟁에 관련된 정책개념은 이미 이전부터 존재하고 있었다. 대리전쟁의 발생시 실제로 전쟁을 치르는 국가는 승패에 상관없이 전쟁의 참화를 입게 되나, 치르게 하는 나라는 실패시에도 자국의 피해가 비교적 적으며, 그 외에도 전쟁의 범위를 좁힐 수 있고 새로운 무기나 전술을 시험할 수 있으며 상대측의 전략 및 전술을 탐지해낼 수 있다는 이점이 있다. 냉전시대에 벌어졌던 국지전들은 많은 부분이 실질적으로 미, 소 양국의 대리전쟁에 속해 있었다."
