순번,Q,A
2,1.4후퇴,"중공군의 개입으로 인하여 1951년 1월 4일 한국전쟁 중 두 번째로 서울을 포기한 사건을 가리킨다. 인천상륙작전의 성공 이후 국군과 UN군은 빠르게 북진을 계속하여 10월 말에는 한국군이, 11월에는 동부전선의 미군이 압록강까지 도달하였다. 그러나 그 직후 중공군이 한국전쟁에 참전을 결정하여 한반도에 진입, 공격을 개시하였고, 방심한 상태에서 연계가 희박해진 채 각각의 부대가 거의 개별적으로 북진해 올라가던 국군과 UN군은 큰 피해를 입고 남쪽으로 되밀려 내려오게 되었다. 중공군의 맹렬한 공격과 급속한 진격이 이루어지는 상황에서 UN군을 지휘하던 워커 장군이 자동차 사고로 사망하였고 그 후임으로 부임한 리지웨이 장군은 1951년 1월 4일 서울을 포기하고 금강 지역에서 새로운 방어선을 만들 것을 결정하게 되는데, 1.4 후퇴의 명칭은 이 결정이 이루어진 날에서 유래되었다. 이후 1월에 실시된 반격작전으로 수원지역까지 진출한 뒤 2월에 있었던 중공군의 공격을 막아낸 국군과 UN군은 1951년 3월 14일 서울을 재탈환하게 된다."
8,3.5인치 로케트탄,"M20 로켓발사기, 통칭 수퍼바주카라고도 불리는 3.5인치 바주카포의 탄체. 혹은 당 바주카포 그 자체를 가리키기도 한다. 제2차 세계 대전 당시부터 사용되던 종전의 2.36인치 바주카포는 소련군의 T-34에 대해 그다지 효과적이지 못했기 때문에 이를 대체하기 위하여 제2차 세계대전 직후부터 개발이 시작되었으나, 탄두 성형의 어려움으로 인하여 개발이 지체되어 한국전쟁 발발 시기에 이르러서야 개발이 완성되었다. 이후 맥아더 원수의 요청에 의해 7월 3일부터 급거 생산을 시작하였으며, 인민군의 T-34에 대응하기 위한 대전차 무기로 3.5인치 로케트탄을 보급해 줄 것을 건의한 미24사단장 딘 소장의 의견이 극동사령부에 의해 수락되어 7월 10일에 대전에 공수되고 동월 12일에 각 보병중대의 화기소대 및 공병중대에 배치, 이후 대전전투에서 최초로 사용된다. 미 육군에서는 60년대 이후 완전 도태되었으나, 한국군은 장갑차 및 구형전차를 파괴할 수 있다는 이유로 아직 상당수를 예비군용 대전차 화기로 보관하고 있다."
10,38선,"북위 38도선의 준말로, 제 2차 세계대전 이후 미소 양국의 합의에 의해 서로간의 점령지역을 나누었던 경계선을 가리킨다. 이 경계선의 설정 원인에 대해서는 1945년 8월 초, 일본에 선전포고를 한 소련은 약체화되고 기갑전력이 부실했던 관동군을 쉽게 격파하고 급속도로 남하하였고, 당시 가장 가까운 부대조차도 한반도에서는 6000마일 이상 떨어진 오키나와에 주둔하여 한반도에 신속하게 상륙하기 어려웠던 미국측이 소련에 의하여 한반도가 전부 장악되는 것을 막기 위해 딘 러스크 대령 등이 급히 제안하여 38선을 설정하였다는 것이 일반적인 통설이다. 분할선이 북위 38도선으로 정해진 근거는 당시 한반도에 주둔한 일본군의 지휘체계 및 작전구역 분할을 따른 것이라는 설이 일반적으로, 당시 북위 38도선의 이북은 관동군 사령관이, 이남은 (일본군)대본영 아래의 조선군관구 사령관이 관할하고 있었다. 38선이 설정되자 병력 일부가 이미 서울까지 들어와 있었던 소련군은 곧 38선 이북으로 철수하였다. 처음의 38선은 임시적인 군사 분계선이었으나 48년 남북이 별개의 정부를 세우면서부터 실질적인 국경선화되었고, 한국전쟁과 휴전협정의 결과로 인해 38선 대신 만들어진 휴전선이 아직까지 남북한을 갈라 놓고 있다."
11,3군 공통품목 통합군수지원,"육.해.공군 중 2개 군 이상이 공통으로 사용하는 장비 및 물자 등에 대하여 특성을 고려하여 1개 군에서 전담하여 타군을 지원하는 제도를 가리킨다. 기존에 각 군이 별도의 군수지원체계를 유지함에 따라 보급지원체제의 이원화 및 인력예산의 낭비 등과 같은 문제점이 제기되어, 이를 제도적으로 개선하기 위하여 한국군은 1985년도부터 통합군수지원제도를 시행, 현재까지 꾸준하게 발전시켜 왔다. 그 결과 인력의 절감은 물론 공통취급 장비 및 물자를 통합하여 획득 및 보급하고 정비지원을 하게 되어 경제적이고 효율적인 군수지원이 가능해졌다. 또한 1997년 5월에는 3군 공통품목 통합지원규정을 보완하여 보급절차뿐 아니라 수송 및 정비 분야까지 확대한 지원체제를 재정립하였다."
13,6.25전쟁,"1950년 6월 25일 북한군의 전면 남침으로 인하여 한반도를 전장으로 하여 벌어진 전쟁을 가리킨다. 한국전쟁이라고도 한다. 전쟁의 초기에는 기갑전력을 앞세운 북한의 우세한 전력에 후퇴를 거듭하였고, 유엔군이 참전한 이후에도 후퇴가 계속되어 낙동강 전선을 최후 방어선으로 하여 방어전을 전개하게 되었으나, 9월 중순에 실시된 인천상륙작전과 그에 맞추어 개시된 낙동강 전선에서의 유엔군 총반격으로 인하여 전세가 역전되어 9월 말에 서울을 탈환하고 10월에는 38선을 돌파하였다. 이후 쾌속으로 진격을 계속한 끝에 유엔군과 한국군은 압록강까지 진격하였으나, 중국군의 개입으로 되밀려 내려와 한때 서울을 다시 포기하였다가 탈환하였다. 이후 전선은 교착화되어 어느 한 쪽의 일방적 승리가 어려운 상황이 되어갔으며, 1951년의 중국군 춘계대공세가 실패로 끝난 뒤 휴전협정이 제안되었다. 이후 긴 휴전회담 끝에 1953년 7월 27일 휴전협정이 조인됨으로써 전쟁은 휴전이라는 형태로 막을 내리게 되었다. 이 전쟁의 결과로 한반도에서는 좌우의 대립이 극심해졌으며, 분단체제가 고착되는 결과를 초래하였다."
118,가변익항공기,"항공기의 속도에 맞추어 날개의 후퇴각을 변형시키는 방법을 통해 어떤 속도에서도 최상의 비행특성을 얻을 수 있게 한 항공기를 가리킨다. 직선익은 저속에서 유리하며 안정성이 높지만 일정 이상의 속도가 되면 날개가 부러질 위험이 있고, 후퇴익은 아음속에서 유리하지만 저속에서는 전진익보다, 초음속에서는 델타익보다 유리하지 못하다. 델타익은 초음속에서 유리하지만 저속에서의 안정성은 매우 떨어진다. 비행 중의 후퇴각 조정을 통해 이러한 3가지 날개 모두의 장점을 취하는 것이 가변익의 목적으로, 이론상으로는 가장 우수한 날개 형태이나 가변익 가동을 위한 작동 장치나 연결부 구조가 복잡하여 가격 및 유지비용이 높아지고 항공기 자체의 무게도 늘어나기 때문에 일부 항공기에서만 채택하고 있다. 최초의 가변익 항공기는 2차대전 말기 독일에서 개발된 P1101로, 비행중 날개각도의 조절이 가능한 항공기가 목표였으나 완성된 기체는 지상에서 임무에 맞게 각도를 조정한 뒤 비행하는 방식이었는데다, 시험기 1대만 완성된 상태에서 전쟁이 끝나 실제 전장에서는 쓰이지 못했다. 대전 이후 미국에서는 F-111을 시작으로 F-14, B-1등의 가변익 항공기를 개발하여 운용하고 있으며, 이외에 유럽의 토네이도, 소련의 MIG-23,27 등이 개발, 운용되고 있다."
143,가상돌파구,"상세설명 상황을 통제할 능력을 보유하고 있는 상태에서 방어의 지속성을 유지하면서 적에게 돌파를 허용할 수 있는 최대의 허용범위를 가상한 폭과 종심을 말한다. 가상돌파구는 도상작전, 워게임 결과를 기초로 적의 부대 구성과 임무, 지형 및 아군이 가진 저지능력의 정도를 고려하여 구상하게 된다. 이때 적 부대가 직사화기로 통제할 수 있는 범위를 산출하고 이를 고려하여 역습부대의 공격개시선을 결정할 수 있다."
145,가상적국,"한 국가의 국방계획을 위시한 국가전략의 구상시 적국으로 가상되는 나라. 실질적 교전상태가 아니라는 점에서 적국과는 구별된다. 본래 국방계획은 그 작성 및 작전의 실행에 있어 군의 동원, 이동, 결전장의 선택 등에 대한 계획을 미리 구체적으로 작성해야 할 필요가 있기 때문에 가상적국의 설정과 당 가상적국의 상태에 따라 국방계획이 바뀌게 된다. 가상적국의 설정은 국가간 이익의 대립여부, 상대국이 가진 능력과 그 위협성, 역사적 조건 등에 의해 달라지나 실질적으로는 역사적인 조건이나 국제관계, 지리적 요건 등에 의하여 거의 자동적으로 설정되는 경우가 많으며, 이미 잠재적인 전쟁상태에 있는 경우가 많다. 그러나 가상적국의 설정이 반드시 가상적국과의 전쟁만을 전제하고 있는 것은 아니며, 대등 혹은 가능한 한 유리한 상태에서의 안정된 관계 유지나 우호관계의 성립 움직임 등과도 상충되는 것은 아니다."
234,가용보급률,"탄약의 소모율을 나타내는 개념. 작전을 수행하기 위하여 일정한 기간 중에 허용된 보급 한계량을 가리키며, 충분한 소요량의 탄약을 확보하고 있어 통제보급률(CSR)을 적용하지 않아도 될 때 사용한다. 무기를 사격함으로 인해 소모되는 탄약의 화기당 1일 발사 탄 수로 표시된다."
246,가정,"지휘관이 계획을 수립하는 과정에 있어서 상황판단을 완성하고 대응할 방책을 결정하는 데 필요한 예측의 한 부분으로, 현재의 상황이나 장차 일어날 상황 및 사건에 대한 예상으로서 명확한 증거 없이 사실로 간주하는 하나의 가설을 가리킨다. 가정은 계획수립 과정의 전반을 통하여 적용되며, 확실한 증거가 제반 가설의 정당성을 입증할 때는 하나의 사실로 간주된다. 최초에 수립한 가정은 첩보를 통해 추가적으로 이용 가능한 정보가 들어옴에 따라 가정이 사실에 일치하도록 하기 위해서 추가적인 정보를 통한 수정을 가한다. 이러한 수정은 작성중인 계획에도 수정을 필요로 하게 되며 융통성을 위해서 모든 참모부서간에 신속히 전달되고 협조되어야 한다."
275,각개격파,"각개격파(各個擊破)는 작전 중인 부대가 적 세력이 유기적으로 통합되지 않고 분산되어 있는 시기를 틈타 분산된 각각의 병력을 순차적으로 공격하여 전력을 무력화하는 것을 의미한다. 적에 비해 적은 병력을 가진 상태에서 공세를 취해야 할 상황에 처했을 때 특히 유용한 전술행동으로, 비록 전체 병력 상에 있어서는 적보다 열세에 있더라도 전투가 벌어지는 구역에 있어서만은 항상 적보다 병력의 상대적 우위를 차지하는 것이 그 목적이자 기본 방침이다. 각개격파는 내선작전(內線作戰)을 수행하는 가장 핵심적인 작전행동이며, 실제로 내선작전은 아군의 병력을 집중해서 분산된 적의 일부에게 결정적인 타격을 입히는 각개격파에 성공여부가 달려있다."
287,간균,"막대기 또는 원기둥 모양의 세균을 가리킨다. 분열균(分菌)의 하나로. 구균(球菌)이나 나선균과 대비해서 사용된다. 길이에 따라 장간균(長桿菌)과 단간균(短桿菌)으로 크게 구분되나, 이 안에서도 양 끝의 모양이나 배열 형태 등에 있어 여러 가지 다양한 형태를 나타내고 있다. 가장 위험한 생물학 무기 중 한 가지로 꼽히는 탄저균이 바로 간균의 일종이다."
330,간접사격,"시계를 사용하지 않고 간접 조준에 의해 이루어지는 사격을 가리킨다. 목표물의 위치가 멀고 표적을 직접 시야에 포착하는 것이 불가능하여 직접조준을 할 수 없는 목표에 대하여 이루어지며, 박격포나 장거리 야포와 같은 곡사화기에서 이러한 사격방식이 사용된다. 사격진지에서는 목표물을 볼 수 없기 때문에 그 위치를 파악하기 어려우므로, 사격의 정확성을 기하기 위해서는 관측소나 공중에서의 도움이 필요하다."
331,간접전략,"국가가 분쟁상황에 대처함에 있어 군사력의 직접적 사용을 필요 최소한도로 한정하고, 그 대신 정치적, 경제적, 외교적 수단 및 심리적 수단 등을 최대한도로 활용하여 적의 전의를 좌절시켜 굴복시키는 전략적 접근방법을 가리킨다. 또한 이는 군사적 협상태세와도 병행하여 사용된다. 국가전략 수행 수단상의 문제로 군사적 수단 외의 다른 수단을 이용하여 국가목적을 수행한다는 점에서 군사적 수단의 사용을 전제하는 간접접근과는 구별된다"
332,간접침략,"제 2차 세계대전 이전에는 동맹한 두 나라 중 한 나라가 무력에 의해 공격받았을 경우, 공격받지 않은 쪽의 국가가 침략을 받고 있지 않지만 동맹국과의 협정에 의거하여 같이 침략받았다고 여겨지는 경우 실제 공격받지 않은 국가에 간접침략이 가해진 것으로 인식하였으나, 제 2차 세계대전 이후에는 특정 세력이 정규군에 의하지 않고 타국 내의 반정부세력을 조종하여 무장봉기 및 정부의 전복을 도모하는 것을 가리키는 것으로 의미가 바뀌었으며, 정규군에 의한 직접적인 무력공격은 이에 대응하는 의미로 직접침략이라 칭한다. 이와 같은 간접침략의 정의가 처음으로 문서화된 것은 1947년 3월에 발표된 트루먼 독트린에서으며, 이후 1947년의 북대서양조약, 1948년의 보고타헌장 등 여러 국제조약에서 간접침략에 대하여 현재의 의미로 규정하고 있다. 일반적으로 간접침략은 직접침략의 이전에 행해지거나 직접침략과 병행해서 행해지는데, 그 수단으로는 무장봉기나 저항운동의 사주 및 지원, 상대국 지배계급 내에서의 쿠데타 획책, 게릴라 침투 등의 무력을 동원하는 수단과 정권탈취를 위한 모략 등이 있다. 경우에 따라서는 직접침략 이후에도 간접침략을 행하는 경우가 있다."
334,간첩,"상대편의 내부에 침투하여 각종 수단을 통하여 그 정보를 탐지하고 기밀을 알아내어 자기 편에 통보하는 사람을 가리킨다. 또한, 상대편의 내부에 침입한 상태에서 허위의 사실이나 유언비어 등을 유포하여 상대편의 혼란 및 오판을 유도하게 하는 사람이나 파괴활동을 일으키는 사람들도 간첩의 범주에 포함된다. 일반적으로 교전국이나 적대국에 대해서 간첩활동이 가장 활발하게 행해지나, 간첩 활동이 반드시 교전국이나 적대국에 대해서만 행해지는 것은 아니다. 간자(間者), 세작(細作), 첩자(諜者), 스파이(Spy) 등 여러 가지 다른 명칭으로 불리기도 하며, 손자병법서에서는 간첩에 대해 그 역할이나 출신 등을 기준으로 향간(鄕間), 내간(內間), 반간(反間), 사간(死間), 생간(生間)의 다섯 가지로 구분하고 있다."
335,간첩선,"적국의 해안에 침투하여 정보를 수집하거나 간첩을 적지에 침투시키는 역할을 맡는 배를 가리킨다. 한국의 해안에 침투하는 북한 간첩선은 공작모선, 공작자선, 잠수함 및 잠수정으로 분류할 수 있는데, 공작모선은 공작자선으로 이용되는 해안침투용의 반잠수정을 탑재할 수 있는 200톤에서 250톤 가량의 대형 간첩선을 가리키며, 통상적으로 중고선박을 이용하여 어선으로 위장하고 있으나 통신장비와 더불어 무장을 갖추고 있으며, 개량을 가하여 매우 빠른 속력(35내지 40노트)을 보유하고 있다. 공작자선은 공작모선에 탑재되어 간첩의 직접 침투에 이용되는 소형의 간첩선을 가리키며, 과거에는 소형 어선이나 낚시배로 가장한 배를 이용하였으나 최근에는 주로 고속 중무장의 반잠수정을 사용하고 있다. 잠수함 및 잠수정의 경우 드러나지 않게 간첩을 해상으로부터 침투시키는 데 이용된다."
433,감응기뢰,"폭발 및 발화방식에 따른 기뢰 분류의 한 종류로, 표적함정이 움직임에 따라 생겨나는 함정 주변의 자기, 음향, 압력 등과 같은 물리량의 변화를 센서를 통해 원거리에서 감지하여 폭발하는 기뢰를 가리킨다. 제 2차 세계대전 이후 널리 사용되는 대표적인 기뢰로서, 어떤 물리량의 변화에 감응하느냐에 따라 자기 감응기뢰, 음향 감응기뢰, 압력 감응기뢰 및, 이들 센서를 복합적으로 탑재하여 소해를 복잡하게 하고 신뢰도를 높인 복합 감응기뢰가 있다. 현대의 기뢰는 대개 복합 감응기뢰가 대세를 이루고 있다."
464,갑종사태,"통합방위사태의 종류 중 하나로, 대규모의 적의 침투도발로 인한 비상사태로서 통합방위본부장 또는 지역군사령관의 지휘통제하에 통합방위작전을 수행하여야 할 사태를 말한다. 국방부장관은 갑종사태에 해당하는 상황이 발생한 때 또는 2이상의 특별시광역시도(이하 &quot시도&quot라 한다)에 걸쳐 을종사태에 해당하는 상황이 발생한 때에, 행정자치부장관 또는 국방부장관은 2이상의 시도에 걸쳐 병종사태에 해당하는 상황이 발생한 때에 즉시 국무총리를 거쳐 대통령에게 통합방위사태의 선포를 건의하여야 하며, 대통령은 위 건의를 받은 때 중앙협의회와 국무회의의 심의를 거쳐 통합방위사태를 선포할 수 있다. 갑종사태의 선포권자는 대통령뿐이다."
496,강제착륙,"비행 중의 각종 사태로 인하여 항공기가 본래의 목적지에 도달하지 못하고 강제적으로 착륙하는 일을 가리킨다. 테러단체 등에 의한 하이재킹으로 인하여 강제착륙되기도 하며, 타국의 영공이나 중립지대 상공, 혹은 비행금지구역에 대한 불법적인 침범을 행하였을 경우 당사국에 의해 강제착륙되기도 한다. 이 경우, 강제착륙을 요구받은 항공기가 계속적으로 강제착륙을 거부할 때에는, 침범당한 당사국 측에서는 상황에 따라 상대 항공기를 격추시키는 조치도 가능하다. 또한 비행 중인 항공기에 중대한 기계적 결함이나 전투손상이 발생하였을 경우에도 규정된 일련의 조치를 거친 후 강제착륙을 행하도록 되어 있다"
585,개별동원,"병력 동원지정시에 동원자원 배정지역 내의 소요자원이 부족할 경우 타지역 자원을 동원지정하여 소속된 예비군부대와는 별도로 동원지정된 소집부대로 개별 입영하는 것을 가리킨다. 집단동원이나 부대단위 동원개념에 대비되는 개념이다. 개별동원의 대상이 되는 것은 해군, 공군 자원 및 육군의 장교, 부사관과 주요특기병, 특수부대 요원으로, 이들은 동원자원이 전국에 산재되어 있기 때문에 부대단위 동원이나 집단동원의 개념에 따른 특정지역에서의 집중동원은 불가능하다. 이로 인해 동원지정을 광역화하는 것이 불가피하여 개별동원에 의해 충원하게 된다."
667,거부작전,"전술 및 전략적인 가치를 갖는 목표물이나 지역을 적이 점령하거나 이용하는 것을 방해하거나 방지하기 위해서 계획된 작전을 가리킨다. 또한 거부작전은 적의 전체적인 작전실시 능력과 이동 능력을 방해하는 것을 목적으로 하고 있으므로 주로 전략적인 개념으로 운용된다. 거부작전은 장벽운용과 더불어 공격작전 및 방어작전에 공히 운용되지만, 일반적으로는 방어작전과 지연작전에서 더 많이 운용된다. 공격시의 거부작전은 장벽 운용과 함께 병력을 절약하고 측방 경계를 도우며, 역습을 방지하고 철수하는 적을 함정으로 몰아넣는 데 사용된다. 방어시의 거부작전은 병력절약과 더불어 그로 인한 더욱 광범위한 분산이 가능하게 하고, 적이 전방 혹은 측방으로 전진해 오는 것을 지연시키거나 와해시켜 아군의 방어화력에 대한 적의 취약점을 증가시키는 동시에 측방 및 후방지역 경계를 돕는다. 거부작전이 적의 전체적인 작전의 실시와 이동 능력을 방해하는 데 비하면 장벽운용은 적 전술부대의 전술적 기동을 감소시킨다는 차이가 있다."
673,거점방어,"방어작전의 한 형태로, 방어지역에 존재하는 지형상의 요충지에 진지(통상 대대급 규모)를 구축하고 사주방어를 할 수 있도록 만들어 거점화하는 방식으로 편성한 방어를 가리킨다. 이 경우, 통상적으로 방어전력을 거점에 집중하게 되는 경향이 있다."
674,거제도포로폭동사건,"한국전쟁 중인 1952년 2월, 공산군 포로를 집단수용하고 있던 거제도에서 발생한 포로들의 폭동사건. 폭동 당시 거제도에는 약 13만 2,000명의 포로들이 수용되어 있었다. 폭동사건 이전부터 수용소의 포로들은 친공포로와 반공포로로 나뉘어 심각하게 대립하는 상태였고 이미 1951년부터 유혈사태가 일어나고 있었는데, 이는 처음 이들을 수용할 때 두 집단을 분리하지 않고 대단위로 혼합수용했던 데서 기인한다. 친공포로들은 해방동맹을, 반공포로들은 대한반공청년단을 조직하였고, 수용소의 각 동은 어느 계열이 주도권을 잡았느냐에 따라 친공계열과 반공계열로 분리되었다. 이후 1951년 말 포로교환 문제가 논의되었을 때, UN군은 제네바 협정의 자동 송환원칙을 어기고 자유 송환원칙을 제시하였으며, 이로 인해 타결이 지연되자 북한측 대표는 북으로 송환되기를 원하는 인민군 및 중공군 포로의 숫자를 제시할 것을 요구하였다. 이에 따라 송환요구자와 미 요구자의 분류를 위해 거제도 포로수용소에서 1952년 2월에 착수된 분리심사에 대하여 일부 포로들에게 본국으로의 귀환 포기를 권유했다는 이유로 친공포로들이 격렬하게 저항하였고, 이들이 주도권을 잡은 동에서 폭동을 일으켜 분리심사에 불응하였다. 최초의 충돌이 일어난 것은 2월 18일로, 이 충돌에서 미군의 발포로 포로측에서 77명의 사망자와 140명의 부상자가 나왔고 미군측에서도 1명의 사망자 및 38명의 부상자가 발생했다. 3월 13일에는 한국군 군경비대와 포로들이 충돌하여 12명의 포로가 사망하고 26명이 부상하였으며, 5월 7일에는 미군병사들에 의한 포로 금품 약탈에 대한 건으로 사령관 면담을 요구한 뒤 친공포로들이 주동하여 수용소장인 돗드 준장을 납치하였다. 새 소장으로 부임한 콜슨은 포로들과 협상한 끝에 포로측 요구조건 일부를 수용하여 수용소의 야만행위 시인, 전원송환 보장, 강제심사 중지, 포로 대표단 구성 인정을 승인하고 돗드를 구출하였다. 그러나 이들은 즉시 동경으로 소환되고 1계급씩 강등되어 퇴역했다. 그 후임으로 부임한 보트너는 강력한 수용소 관리를 시작하여 수용소 경비병들에 대한 군기 확립, 500명 규모의 포로 분할 수용, 거제도 이외의 수용소 건설, 적기 게양 포로 사살 등의 방침을 세웠다. 5월 말부터 계획에 착수하여 6월 1일 포로대표 이학구를 영창에 감금하고 6월 10일 소단위로 분산 수용하기 위해 친공포로들이 주도권을 잡고 있었던 76수용소에 전차와 군대를 앞세워 위협하면서 진입하였다. 이후로도 유혈사태는 계속되어 6월 13일에도 76수용소에서 충돌이 발생하여 포로측 38명이 살해되고 195명이 부상당했으며 미군측 1명이 사망하고 14명이 부상을 당했다. 10월 1일에는 중공군 포로수용소에서 중공군 56명이 살해되고 120여 명이 부상당하는 사건이 발생하였다. 12월 4일에는 봉암도수용소에서 폭동이 발생하여 포로 87명이 사망하고 115명이 부상을 당하기도 했다. 1952년도에는 이러한 크고 작은 폭동이 계속되었다."
