순번,Q,A
13662,정보보증,"기존의 정보보호 개념에서 한단계 더 발전된 개념으로, 정보 및 정보 시스템의 가용성, 무결성, 인증, 비밀성 및 부인방지를 보장하여 정보 및 정보 시스템을 보호하고 방어하는 것이다. 여기에는 외부로부터의 침입을 탐지하고 침입에 대한 대응능력을 강화시키며, 침입으로부터 중요 정보통신 기반을 보호하고, 이의 조화에 의해 정보 시스템을 복원하는 능력까지를 포함하고 있다. 이와 같은 정보보증의 개념은 1996년 12월 미 국방부 지침 S-3600.1 정보작전(DoD Directive S-3600-1, Information Operations)가 발표되면서부터 대두하게 되었다. 이 지침은 기존 정보전에 대한 미 국방부의 인식이 갱신되었음을 보여주고 있으며, 현재 미국은 다방면에서 정보보증 노력을 행하고 있다."
13663,정보융합체계,"다양한 센서로 부터 얻어진 다량의 데이터를 융합기법을 이용하여 양질의 정보를 만들고, 이들 서로의 상관관계를 파악하여 상황 및 위협평가를 실시하여 지휘관의 결심지원에 필요한 자료를 제공하는 체계이다. 정보융합체계는 크게 필요한 정보를 신속정확히 제공하기 위하여 적시적소에 센서를 배치하는 센서관리, 각종 센서에서 수집되는 데이터들을 기존의 데이터베이스에 사건별, 시간별로 적절히 연계 및 갱신시키는 데이터 연계과정, 중복되어 수집되는 표적이나 사건들을 범주별로 분류하고 분류된 데이터들을 결합하여 정보의 불확실성과 모호성을 감소시키는 데이터 결합과정, 그리고 결합된 데이터들로 부터 표적의 이동과 의도를 밝히는 데이터 추론과정, 상황위협평가를 실시하여 지휘관 지휘결심을 지원할 수 있는 자료를 제공하는 지휘결심지원과정으로 나누어진다."
13664,정보작전,"군사적인 정보우위를 달성하기 위해 아군의 정보, 정보체계 및 C4I체계를 보호하는 동시에, 적의 정보체계 및 C4I체계를 교란, 파괴하는 일련의 군사작전. 즉 군사면에서의 정보전을 가리키며, 계획에 입각한 정보전의 구체적인 수행 그 자체를 가리키기도 한다. 아군의 정보 및 정보체계를 보호하는 수단으로서는 파이어월(firewall)등의 네트워크 보안체계나 기타 각종 보안의 강화 등을 들 수 있으며, 적 정보체계를 파괴하기 위한 수단으로는 직접적인 해킹이나 컴퓨터 바이러스, 웜(Worms), 트로이 목마(Trojan Horses), 논리폭탄(Logic Bombs) 등과 같은 소프트웨어적인 방법, 하드웨어 칩에 이상기능(Malfunction)을 첨가하는 행위, 컴퓨터 하드웨어의 고장을 야기시키는 소위 나노머신(Nano Machine)으로 분류되는 초소형 로봇의 사용, 전파방해 및 전자 목표물의 기능을 마비시키는 고출력 무선주파수 총(High Energy Radio Frequency Gun) 등을 들 수 있다."
13667,정보제압,"정보영역을 통제하는 데 필요한 제반 방책을 가리킨다. 목적 및 운용형태에 따라 공격적인 정보제압과 방어적인 정보제압으로 나뉘어진다. 공격적인 정보제압은 아군측에 정보영역을 사용 가능하도록 보장하는 동시에 적에게는 사용치 못하도록 차단하는 것으로서 물리적 공격, 군사기만, 심리전, 전자전 및 정보공격 등의 수단이 사용되며, 방어적인 정보제압은 아군측의 정보를 적의 정보작전으로부터 보호하는 활동으로서 물리적인 방어, 물리적 보안, 견고화, 작전보안, 통신보안, 컴퓨터 보안 및 방첩 등의 수단이 사용된다."
13845,제공작전,"전투지역 상공의 공중우세를 획득하고 유지하기 위해 적의 공중세력과 방공체계를 파괴 또는 무력화시키는 작전을 가리킨다. 이는 적의 항공 공격으로부터 아군의 육, 해군을 보호하는 동시에 아군 부대에 행동의 자유를 주게 되며, 후방의 보급로를 안정적으로 지킬 수 있게 한다. 제공작전은 크게 공세제공작전과 방어제공작전으로 나뉘며, 이에 더하여 대공제압을 별도의 분류로 놓기도 한다."
13922,제파공격,"파상공격의 일종으로, 1파로 공격하고 다음 2파는 1파보다 더 많은 병력을, 3파 때는 2파 때보다 많은 병력을 동원하는 방식으로 연속적인 공격을 끊임없이 가하여 방어선에서 수비하는 적병에게 끝없이 밀려오는 적에 대한 공포감을 느끼게 하고 사기를 떨어트려 방어선을 무너지게 하는 공격작전을 가리킨다. 계속해서 몰아치는 파도가 결국 축대를 무너트리는 것과 유사하다 하여 제파공격이라는 이름이 붙었으며, 제 2차 세계대전 때의 소련군에서 끊임없는 보병돌격의 형태로 처음 생겨나 이후 공산권에서 널리 운용되었다. 한국전쟁 때 인민군과 중공군이 사용한 예가 있으며, 월남전에서의 월맹군도 이 작전을 많이 사용하였고, 현재의 북한군 역시 제파공격 전술개념을 아직 유지하고 있다. 이 공격작전의 시행에는 전투가 벌어지는 전장에서 적을 압도할 수 있는 물량과 단호한 공격 의지가 필수적이다."
13950,제한전쟁,"한정된 정치적 목적 등의 특정한 목표에 부합되도록 작전행동지역, 사용수단, 사용무기, 투입병력 및 달성해야 할 작전목표 등에 일정한 제한을 가하면서 정규군을 통해 수행하는 무력전을 가리킨다. 전장이 일정한 지역으로 한정된다는 점에서는 국지전쟁과 유사하나, 국지전쟁은 전장이 제한되어 있더라도 수행 당사국에게는 국가 전체 국력을 기울이는 총력전이 될 수도 있는 반면, 제한전은 지역 외에도 투입병력이나 달성목표 등도 한정되어 있어 전쟁의 규모가 일정 이상으로 커지지 않는다는 점에서 국지전쟁과 구별된다. 완전한 총력전의 형태에 돌입하게 되지 않는 범위 내에서 전쟁규모를 제한해 나가면서 국제적 여론에 따라 투입하는 무력의 수준을 조절하거나 전쟁 중에도 교섭을 행하는 등의 모습을 보이기도 한다."
14119,종심방어,"적의 공격을 유인하고 점진적으로 약화시키며, 모든 진지를 적이 최초에 관측할 수 없도록 방지함으로써 지휘관으로 하여금 효과적으로 예비대를 이용한 기동을 행하게 할 수 있도록 계획된 상호 지원 방어진지의 배치를 가리킨다. 종심방어를 위해서는 충분한 방어종심이 필요한데, 이는 방어의 종심이 얕을 경우 방어측이 적에 대한 효과적인 대응조치를 취하기 전에 방어가 무너질 수 있다는 취약점이 있으며, 핵 또는 화생무기의 지원을 받는 경우를 포함한 적의 강력한 공격은 아군의 전방 방어지역을 돌파할 수 있기 때문이다. 그러므로 효과적인 종심방어를 위해서는 전방방어지역이 돌파된 뒤에도 적을 견제 또는 유인하고 역습을 실시할 수 있도록 방어지대가 충분한 종심을 가지고 있어야 한다. 방어종심을 유지하기 위해서는 방어자측에서 적절한 부대전개 및 부대기동을 행하고 저지진지, 야전축성, 장벽 등의 수단을 동원하면서 화력 및 예비대를 적절히 운용하는 등의 행동을 취할 필요가 있다."
14120,종심작전,"1. 냉전시대에 서방진영에서 방어작전 개념으로 개발된 작전으로, 기본적으로 조기에 전장을 적지로 확대하고 적지결전을 추구하여 자국 영토의 보전을 도모하기 위한 목적을 가지고 있는 작전으로, 아군의 전투력을 보존하면서 적의 전투력 및 전투의지를 약화시키기 위해 적의 종심 깊은 곳에 있는 적 전투력의 중추부를 타격하는 것이 그 기본골격이 된다. 전방 접적지역에서의 적 공격부대에 대해서는 고착견제를 행하면서 적의 후방지역과 화력지원 수단 및 접적지역으로 향하는 적 후속제대에 공격을 가하여 전방지역에서의 적 압력을 배제하고, 이를 통하여 최종적으로는 적지 결전을 추구하게 된다.  2. 제 2차 세계대전 이전 구 소련의 투하체프스키에 의해 고안되고 개념이 정리되어 제 2차 세계대전 이후 구 소련의 선제공격용 교리로 채택된 전술을 말한다. 전차와 보병전투차량을 결합시킨 고속 기동타격부대를 주축으로 적진에 대한 지속적인 제파공격 작전을 행하여 전장의 광정면에 걸친 적의 방어망 중 얇은 부분에 집중적으로 파고들어간 뒤 돌파구를 넓히면서 적의 종심을 따라 강하게 돌파함으로써 적진을 일시에 붕괴시키는 것을 목적으로 한다. 이 과정에서 공정대에 의한 종심타격이 이루어지기도 한다."
14305,주한미군방송,"주한미군의 방송망을 가리킨다. American Forces Korean Network의 약칭으로, AFN Korea의 호출약칭이기도 하다. AFRTS(Armed Forces Radio and Television Service)의 해외 방송망 중 하나로, 주한미군사령부 공보부가 설치하여 1950년 첫 방송을 시작하였다. 공중파 방송으로 AFN Korea TV, Eagle FM 및 Thunder AM 등을 운용하고 있으며, TV 및 라디오 매체등을 통해 주한 미군, 군무원 및 그 가족들에게 지역 사령부의 정보, 뉴스 및 각종 오락을 제공하는 것을 기본 임무로 하고 있다. 본부는 용산 미군 부대 내에 위치하고 있으며 용산, 의정부, 오산, 군산, 대구 등 다섯 개의 지국으로 운영되고 있다."
14357,중거리탄도탄,"사거리가 25005500㎞ 정도에 달하는 탄도미사일을 가리킨다. 핵미사일의 경우 준중거리탄도미사일과 더불어 전술핵과 전략핵의 중간적 개념인 전역핵으로 분류되며, 전술핵무기와 전략핵무기로 나누게 될 경우에는 전략핵무기의 범주에 속한다. 중거리탄도미사일을 운반체로 하는 중거리핵전력의 경우 미국과 구소련은 1988년의 군축결정에 따라 폐기하였으며, 중국과 프랑스가 자체개발하여 운용하고 있다."
14417,중성자탄,"방사능 무기의 일종으로, 핵반응시 발생하는 중성자와 중성자선을 이용하여 인명에 대한 살상능력을 높인 폭탄이다. 일반적인 핵폭탄에 비하여 소형이며 출력도 낮은 전형적인 전술핵무기로, 그 폭발의 위력과 잔류방사선은 히로시마 원자폭탄에 비교해서도 그 1/10 또는 그 미만으로 작으나 보통의 핵폭탄에 비하여 중성자량을 크게 높였기 때문에 폭풍이나 열에 의한 살상영역보다도 방사선에 의한 살상영역이 넓다. 노출된 인원에 대해서는 같은 폭발력의 다른 핵무기에 비해 약 두 배에 달하는 살상반경을 가지고 있으며, 전함이나 전차, 건조물 등의 내부에 있는 인원에 대한 살상반경은 약 세 배에 달한다. 폭풍 및 열의 영향권 바깥쪽의 방사선 살상영역에 있는 건조물, 차량 등의 경우 그 자체는 전혀 피해를 입지 않으나, 내부의 인원들은 치사선량 이상의 방사선을 받아 사망하게 된다."
14432,중순양함,"순양함의 분류 가운데 한 가지. 1931년의 런던 군축조약에서 처음 그 정의가 정해졌으며, 주포의 구경을 기준으로 하여 그 구경이 15.2cm를 넘어서는 것을 중순양함으로 분류하게 되었다. 중순양함은 전함의 축소판으로서 구축함의 확장판에 속하는 경순양함과는 화력과 장갑방어력을 비롯한 전투능력에서 많은 차이를 보였다. 제 2차 세계대전 이후 항공모함을 중심으로 함대들이 재편되고 이전의 포격전식 함대전이 사라지게 되면서 순양함의 주무장도 함포에서 미사일로 바뀌게 되었으며, 이로 인하여 구경으로 인한 분류는 거의 의미가 없어지게 되었다. 장비 및 배수량을 기준으로 경순양함과 중순양함을 구분하기도 하나, 현대함선의 분류에서 경순양함과 중순양함의 분류는 거의 의미가 없기 때문에 그러한 기준이 엄밀하게 적용되는 일은 별로 없다."
14512,지,"지상 또는 함상에서 비행중인 목표에 대해 발사되는 유도탄을 가리킨다. 일반적으로 고사포에 비하여 명중도 및 전천후성에서 우수하기 때문에 대공전투에 있어 가장 중요한 무기로 여겨지고 있다. 유도방식에 따라 지령유도, 호밍유도, 지향전파유도로, 사거리에 따라 장거리, 중거리, 단거리용으로, 운용고도에 따라 고고도용, 중고도용, 저고도용으로 분류된다. 지상에서 운용되는 지대공유도탄은 소련의 SA-2와 같이 고정기지에서 운용되기도 하지만 영국의 레이피어나 미국의 M-48처럼 차량에 탑재되어 기동성있게 움직이기도 하며, 보병이 휴대하면서 사용할 수 있는 종류도 있다. 한국군에서 운용하고 있는 지대공유도탄으로는 장거리요격용의 나이키 허큘리스, 중거리요격용의 호크, 단거리요격용의 미스트랄, 스팅어 및 국산 지대공유도탄인 천마 등이 있다."
14571,지령유도,"외부에서 미사일에 송신된 정보가 직접 미사일을 유도하는 유도방식을 가리킨다. 유도탄 외부에서 모든 정보를 획득하여 산출한 유도신호를 유도탄에 지령으로 전달하면 유도탄이 이에 따라 움직이게 되는데, 유도를 위한 주요장비가 모두 유도탄 외부에 설치되므로 유도탄 자체의 구조가 간단한 편이고 가격도 다른 유도방식에 비하여 저렴한 편이나, 외부장비가 복잡하고 원거리 표적에 대한 정확도가 떨어지는 편이며, 다표적 동시 대응 능력이 일반적으로 약한 편이다. 지령유도의 방식에는 발사지점에서 유도탄 및 표적에 대한 거리와 방향, 속도, 정보를 측정하고, 이를 이용하여 예상 명중점을 설정하여 유도탄에 유도명령을 송신하는 비시선 지령유도(Command off the Line of Sight)와 사람이 직접 조준기를 통해 보면서 조작하여 발사대와 유도탄을 연결한 와이어를 통해서, 또는 무선으로 유도신호를 보내는 시선 지령유도(Command to the Line of Sight), 발사지점에서 지정된 표적을 향하여 빔을 조사하면서 유도탄을 발사하고 조사되는 빔의 중심에 유도탄을 위치시켜 빔을 따라 표적을 공격하는 빔 편승(Beam Riding)유도방식 및 유도탄에 장착된 탐색기로 표적정보를 측정하여 발사지점으로 송신하면 발사지점에서 신호처리 및 유도명령 계산을 수행한 후 이것을 유도탄으로 다시 송신해 주는 미사일 경유 추적법(TVM : Track Via Missile)이 있다."
14626,지상 감시레이더,"전파를 발사하여 물체에 부딪쳐 되돌아올 때의 입사선과 방사선의 주파수 차이로 인하여 나타나는 도플러 효과를 이용하여 표적을 탐지하는 장비이다. 현재 한국군에서 운용하고 있는 것은 프랑스 리미트 사의 RASIT 시스템으로, 탐지거리는 인원 14-18km, 차량 25-30km, 헬기 10-28km이며 고도운용거리는 4km이다. 이는 적 예상 접근로 및 취약지역에 배치하여 적의 이동표적에 대하여 탐지 및 추적과 감시를 행하는 전술제대의 주 감시 수단으로 이용되는 전천후 이동물체 감시레이더로, 장비의 고정 및 이동설치가 가능하고 이동목표 탐지 식별은 용이하나 고정표적 탐지에는 제한을 받는다. 표적 위치는 8계단 방위각으로 자동 산출되어 화면상에 점으로 표시되며, 표적성질은 음향을 통하여 식별하게 되어 있다. 대포병사격을 위한 위치계산에도 이용될 수 있다."
14744,지역방어,"명시되어 있는 일정한 기간 동안 특정한 진지나 지역을 확보 또는 통제하는 방어형태를 가리킨다. 작전의 목표가 되는 지형을 계속적으로 확보하는 데 가장 큰 우선순위를 두게 되며, 전방지역에 전투력할당의 우선권을 부여하고 최소한의 예비대를 운용한다."
14760,지연작전,"차후작전의 유리한 여건을 조성하기 위하여 적에게 피해를 강요하면서 적으로부터 조직적으로 이탈하는 작전을 가리킨다. 궁극적으로 주도권을 확보하여 적을 격멸하기 위한 노력의 일환으로, 적의 압력에 의하여 현 진지의 고수가 불가능하거나 현 진지에서 방어임무 수행이 불리하다고 판단될 때, 또는 상급부대의 명령에 의해 지연임무를 부여받았을 때 실시되며, 그 주된 목적은 전투력의 보존과 시간 획득, 적 전투력의 약화와 적 부대 유인 등이다. 지연작전의 성공적 수행을 위한 준칙으로는 적 기도 식별과 아군의 기도 은폐대책 강구를 위한 전장감시, 주도면밀한 계획과 협조, 기도비닉과 기만, 유리한 지형의 이용, 가능한 모든 수송수단의 이용 및 적 기동 제한을 통한 기동성의 발휘, 화력과 장애물의 효과적인 운용, 적에게 손실을 강요하고 추격의 차단 혹은 지연을 달성하기 위한 적극적인 공세행동 및 확고한 부대 장악을 들 수 있다. 지연작전을 실시할 때에는 지형의 이점과 가용한 전투력을 최대로 활용하여 원거리에서부터 적 전투력의 소모를 강요하고, 각종 공세 행동으로 적의 공격을 지연시키거나 혼란을 조성하는 등 최소의 공간을 양보하면서 작전목적을 달성해야 한다. 지연작전의 형태에는 지연전, 철수, 철퇴가 있다."
14847,지형추적 레이더,"항공기에 탑재되어 저고도로 비행하는 항공기를 안전하게 수동으로 조종할 수 있도록 전방 지형을 디스플레이에 시현하거나, 신호를 통하여 저공에서 일정한 고도를 유지하면서 비행할 수 있도록 돕는 레이더를 가리킨다. 항공기가 저공에서 안정적인 순항비행 및 지형추적비행을 행하는 데 있어 매우 유용한 장비이다."
14848,지형추적비행,항공기가 지면으로부터 일정한 고도를 유지하면서 지형의 굴곡에 맞추어 따라 비행하는 것을 가리킨다. 이를 위해서는 지형추적레이더가 필수적이다. 폭격임무를 위해 저공으로 침투해야 하는 항공기들의 경우에는 지형추적비행능력을 갖추고 있는 쪽이 훨씬 높은 안전성을 보장해 준다
14885,지휘소연습,"각급제대의 지휘관 및 참모의 지휘본부와 통신요원 등을 훈련시키기 위한 연습으로 가상상황하에서 통신을 유지하면서 지휘소이동 및 운용, 지휘 및 참모절차연습, 작전계획 및 작전예규의 적용, 각종 상황하에서의 지휘 및 통제능력을 배양하기 위한 연습이다. 한국군에서는 을지포커스렌즈 훈련의 일부분으로 행해지며, 압록강연습으로 통칭된다.(2005년부터 태극훈련으로 개칭예정)"
14955,진내사격,"방어사격의 한 형태로서 돌파의 제한 또는 역습을 지원하기 위하여 전투진지 내에 행해지는 사격을 가리킨다. 적의 공격에 전투지역 전단의 일부를 돌파당하고 불가피하게 적의 돌격을 저지하기 곤란한 상황에서 실시되며, 포격을 견디어 낼 만한 엄체호를 사전에 구축하고 진내사격에 대비한 우군 요원의 안전대책을 강구한 후에 진내사격을 요청하는 것이 일반적이다."
15000,질식작용제,"노출된 인원의 코, 목, 폐 등의 호흡기를 손상시키는 화학무기의 한 종류이다. 옥수수 냄새나 갓 베어낸 풀 냄새가 나며, 노출되었을 경우 두통, 구토, 가슴압박과 같은 증상이 나타나고, 심한 경우에는 점막이 부으면서 폐가 물로 가득 차게 되어 폐수종으로 사망하게 된다. 질식 작용제의 효시라고 볼 수 있는 것은 염소 가스이나, 염소가스는 현재 군사용 화학작용제로 분류되지 않는다. 이외에 제 1차 세계대전 중에 등장하여 작용제 희생자 중 8할 정도를 발생시킨 포스겐(CG), 높은 비점으로 탄에 충전이 용이한 디포스겐(DP), 극소량으로도 무능화를 초래하는 PFIB 등이 있다. 포스겐은 폐에만 작용하여 폐의 모세혈관에 손상을 초래하며, 디포스겐 역시 체내에서 포스겐으로 변환되므로 작용은 포스겐과 동일하다. 질식 작용제에 노출되었을 경우의 응급 처치로는 체온 유지와 신선한 공기의 호흡, 따뜻한 물의 섭취와 인공호흡 및 후송 등이 있다"
15023,집단안전보장,"여러 나라의 협력을 통하여 국가의 안전을 보장하려는 안전보장 방식의 한 가지. 다수의 국가가 조약을 맺어 가맹국간의 상호 불가침을 약속하여 전쟁 및 기타의 무력행사를 금지하고, 이를 위반하고 타 가맹국에 무력행사를 통하여 침략을 행하는 국가가 있을 경우에는 다른 모든 가맹국이 이 침략행위를 저지하기 위하여 협력하는 방식으로 운용된다. 유엔헌장에 규정된 집단적 자위권을 근거로 만들어진 북대서양조약기구(NATO)나 바르샤바조약기구와 같은 군사동맹도 집단안전보장이라는 이름으로 불리기도 하나, 이는 군사동맹국가의 외부에 가상적국을 설정해 둔다는 점에서 조약국 내부의 침략적 행위 억제를 목적으로 운용되는 집단안전보장과는 본질적인 면에서 다르다."
15094,차량화부대,"일반적으로 서방식의 분류에서는 운송용의 차량을 이동수단으로 삼아 기동성을 높인 보병을 가리킨다. 기갑부대를 이용한 작전시, 기갑부대만이 전진해서는 고립되거나 포위되기 쉽기 때문에 기갑부대의 돌파 후 즉시 후속 보병부대가 전진하여 지원할 필요가 있으며, 이를 위해서는 보병들이 기갑부대의 전진을 따라갈 만한 이동속도와 기동성을 갖고 있어야 할 필요성이 생기게 된다. 그리고 일반적인 도보행군으로는 기갑부대의 전진속도를 따라잡을 수 없기 때문에, 이동속도와 기동성의 확보를 위해 차량을 이용하여 이동하게 되는 것이다. 이러한 이유로 제 2차 세계대전 시기에 처음으로 대규모 실전에 적용되었던 전격전의 수행 과정에서 차량화 보병이 본격적으로 나타나기 시작하였으며, 현재에 이르러서는 이에서 한걸음 더 나아간 기계화보병의 운용이 보편화되고 있다. 현대 육군의 보병 운용에 있어서도 보병부대의 신속한 전개와 작전수행 및 기갑부대와의 원활한 협조를 위해서는 보병의 차량화 및 기계화가 필수적이라 할 수 있다. 단, 구 소련식의 분류에서 차량화보병으로 지칭하는 것은 서방식 분류로는 기계화보병으로, 구소련의 차량화보병부대는 운송용 차량이 아니라 BMP계열의 장갑차량을 운용하고 있다."
15176,찹스틱16계획,"한국전쟁기간 중인 1952년에 수립되었던 제한된 공격계획 중 한 가지. 지속적인 대치상태에서 아무 것도 하지 않고 시간을 보내는 군대가 가지는 위험성을 고려한 밴플리트 장군에 의해서 Chopstick 6 계획과 함께 1952년 4월에 계획되었다. 기본 계획은 한국군 제 1군단으로 고성까지 진격한다는 것이었는데, 미군은 작전에 투입시키지 않는다는 조건 하에 승인되었으나, 4월 28일 판문점 회담이 재개되면서 적에게 자극을 주지 말아야 한다는 이유로 무기한 연기되었다."
15177,찹스틱6계획,"한국전쟁기간 중인 1952년에 수립되었던 제한된 공격계획 중 한 가지. 지속적인 대치상태에서 아무 것도 하지 않고 시간을 보내는 군대가 가지는 위험성을 고려한 밴플리트 장군에 의해서 Chopstick 16 계획과 함께 1952년 4월에 계획되었다. 증강된 한국군 1개 사단으로 미 제9군단 정면에서 평강까지 진격함으로써 미 제9군단의 전선을 현상태에서 금화 - 평강 선까지 추진한다는 계획이었으나, 당시 UN군의 사령관을 맡고 있던 리지웨이 장군에 의해 기각되었다"
